,id,title,content,cluster
17599,1520413473385_F01,國泰人壽保險,事情是這樣的，接到國泰人壽專員電話推銷儲蓄險<BR>很吸引出社會兩年的小妹我<BR>專員:每個月存3450，隔年就可以先領8000元，繳完20年期後，每個月可領10000元<BR>就是終身俸的概念，直到老死。<BR><BR>因為想到今年要滿25歲，今年如果開始保這項儲蓄險，那45歲後就可以每個月都領10000元，<BR>52歲就回本了，所以腦袋一直深思當中，但對理財方面不甚了解<BR><BR>煩請各位幫我看看，謝謝大家。,7
17653,1520610582404_F01,現在能買人民幣定存嗎？有一筆臺幣65w短時間用不到?要怎麼理財,保險一直推薦我臺幣每年定存<BR>但是我想一次存65w短期6年<BR>要如何理財才會賺?<BR>保險一直推銷人民幣 可是會不會有匯差賺不了利息?<BR>怕那保險亂推銷,7
17663,1520658980508_F01,列舉扣除額節稅：保險費 建議,"最近郵局六年可回保險已經到期,本來要再保,但郵局說六年保險已經停賣<BR>看了一堆其他保險公司的,好像都沒有一樣的<BR>請問各位有何推薦的儲蓄險可以買<BR>條件:<BR>1.保險金年繳約24000<BR>2.18歲以下<BR>3.六年內可領回,IRR要正的,要可領回即可,目的就是扣稅而已",7
17716,1520868678188_F01,保險(醫療與儲蓄),"各位大大好,<BR>目前小的身上沒有任何保單(35Y)<BR>最近想要保險，但希望是有醫療險的保障，且將來也可以將錢領回來<BR>有一點醫療儲蓄險的概念<BR>請各位大大提供建議哪種險適合我? 哪家保險公司比較好?<BR>拜託大大了~~~",7
17731,1520925287228_F01,分享一下你如何做財務規劃呢???,小弟資質不好，從22歲才開始做財務分配.....今年準備滿31了<BR>想要問問版上的神人都怎麼樣做自己的財務規劃??<BR>我從我自己說起<BR>我薪資分配分為三大塊<BR>1.風險投資(股票)<BR>2.保險(醫療意外癌症儲蓄)<BR>3.生活開銷(房租+剛性需求)<BR>股票: 之前都買電子股，去年才開始定存金融股只進不出(玉山金 台中銀 華南金 合庫金 國泰金)<BR>保險: 20年台幣儲蓄一張 每月3K台幣 (入伍前一天保的，42歲繳完)<BR> 6年美金保單兩張 每月6.1K台幣 (一張已經繳完，第二張準備第三年)<BR> 終身醫療20年 每月2.6K 台幣<BR> 意外產險 每年888台幣(實支實付2萬元) <BR>生活開銷: 房租10k+水電瓦斯網路1k+手機費1.4K<BR> 食衣+交通費 10K <BR> 汽車稅金17K/12 + 停車費2K<BR>小弟用以上的規劃生活了10年，想要規畫下一個十年計劃，希望參考能各位財務規劃以及意見XD<BR>大家分享一下自己的吧....謝謝。,7
17799,1521082134883_F01,關於台銀人壽富貴人生增額終身壽險退保問題,"各位前輩們好，<BR>小弟有個問題想請教各位。<BR>在前年10月左右，<BR>有業務來辦公的地方推銷這張保單""台銀人壽富貴人生增額終身壽險""<BR>當時迷迷糊糊的就簽下去了，<BR>保的是20年 35萬，月繳5560元。<BR>但這幾個月下來，越看越覺得這張保單很爛，<BR>一來太久二來貌似利率也不好，<BR>所以想將這張保單認賠退掉。<BR>結果傳了訊息給當初的業務，她說她已經離職，之後也就沒再回我訊息，<BR>所以我想請問，還有哪個管道可以將這張保單退掉，流程又是如何呢? <BR>想說這兩天就退掉，不然到月底又會再扣一次款...<BR>想請教有相關經驗的前輩告訴我方法...謝謝。",7
17872,1521345895599_F01,南山產物拒絕理賠，合理嗎？,（3/19）下午南山產物打電話來，換了個理由：因我媽媽跌倒受傷並不是因為寺廟擺攤的設備而受傷的，所以不在理賠範圍內。<BR>這個理由我們家就可以理解，南山產物不理賠的原因。<BR>這次的事件讓我真心覺得 南山產物根本就是亂找理由唬攏客戶，完全沒有讓人感受到屬於保險公司的專業。<BR><BR><BR>再次感謝各位網友的關注和留言，南山產物總算在今天（3/19）<BR>早上打電話與我媽媽聯絡，說 要寺廟有責任，南山才會給付我媽保險金，廟方沒有責任的話，南山產物是不會理賠保險金的。<BR>那這不代表著 南山理賠部給的書函（圖2、3）中裡面的理由根本就是敷衍，不成立？<BR><BR>1.很多人告訴我，跌倒不算意外....那怎麼才算意外？（ 我家申請 國泰、台灣人壽，保險公司都說是意外，給付在一個月內就完成了）為何不是意外？難道壽險和產險公司對意外的定義不一樣嗎？<BR>2.另有說不在承保範圍內，可是就圖1，南山產物承保的範圍是圖4整個紅色圈的範圍，我媽跌倒的地方是綠色圈，怎麼會不在承保範圍內？ 如果僅承保土城綜合體育場內的 假日藝術廣場，那保單上為什麼只寫土城綜合體育場？ <BR>在此我要很感謝mobile01上各位熱心的網友回答我的問題，不過有幾點我想再說明一下<BR>1. 我媽媽是當天參與活動的活動人員，只是很不幸的還沒開始義賣就不小心跌斷了腿。<BR>2. 圖2、3 的照片是 南山產物的回覆，金融消費評議中心是要求南山產物和我媽媽出面一起談，但是 南山產物拒絕配合。<BR>3. 金融消費評議中心並沒有認同南山產物拒賠理由，金融消費評議中心是說若南山產物一直不出來解決，建議我媽直接走法律途徑。<BR>4. 圖4 紅色圈是土城綜合體育場（圖1南山產物保險的承保範圍）。藍色圈是活動義賣攤位位置 。綠色圈是我媽跌倒受傷位置。<BR>5.事發當天，在場參與義賣活動的寺廟人士和南山業務員也說 保險會理賠，等我媽住院動完手術2-3天後，南山產物就以 市公所發的公文說不在保險範圍內，拒絕理賠。<BR><BR>我媽媽2018/1/1當天參加寺廟舉辦的義賣活動，在到達土城活動中心時因為擔心遲到，不小心絆到跑道邊的凸起，導致右腿髖關節骨折，寺廟表示有向南山產物投保公共意外責任險，可以請南山理賠。 <BR>結果我們去詢問南山產物，南山產物拒絕理賠，還說要我們自己去找土城市公所理賠，我媽媽向寺廟要了當天承保的保單，我看不出來到底有什麼理由可以不理賠。<BR><BR><BR><BR>跑道邊坡是位在土城活動中心內，隔著跑道就是 假日藝術廣場。<BR>保單上寫的 被保險人營業處所是 土城綜合體育場 並沒有 表示僅限 假日藝術廣場<BR>假日藝術廣場是寺廟向 市公所承租的點點，但這是 寺廟與市公所的簽約，並不是 寺廟與南山產物的合約， 南山產物拒賠後，我們有去詢問市公所，市公所表示寺廟與市公所簽約地點- 假日藝術廣場的公文與 寺廟和南山產物簽訂的公共意外責任險並不相干。<BR>評議委員會也是跟我媽說南山產物應該要理賠，但是南山產物拒絕出席，也不理會評議委員會的通知。<BR><BR>,7
17946,1521555622791_F01,投資美元保單躉繳,想請教版上大大~有人有做美金美元保單嗎??<BR>有推哪一間保險公司躉繳的嗎???還是要注意那些事情??,7
17950,1521566103784_F01,醫療險問題一問,現在有20年領回的保單嗎?<BR>那家比較好?<BR>現在想保沒啥頭緒@@,7
18002,1521706014049_F01,意外飛來一筆開銷的壓力,最近看到一則新聞，若一個人年收入在44萬以下，平均月收約為4萬元以下，<BR>出個車禍，需要修車費、醫藥費兩三萬，也可能需要休養一陣子，身邊沒有任何財力可支援的狀況，<BR>這短少的兩三萬，再加上可能受傷無法工作的狀況，就足以成為生命中不能承擔的重了。<BR>如果平平穩穩的生活收入差不多三萬以上，突然飛來一筆龐大金額的開銷，承擔的就不只有帳單的壓力。<BR><BR> 前兩個月聽我朋友說她的醫療險前兩年快繳完時，還在想都沒用上，<BR>結果先生一場大病，總共賠了快三十萬，算一算，<BR>當初繳的保費大概回來了大半，加上是終身醫療，<BR>以後年紀漸長，還是加減可以用，她說沒有錢，才更需要保險當後盾。<BR> 自從聽到朋友說，我不知道自己的經濟能力有沒有辦法支付保單費用，<BR>找到一個平台秒速算保險網，它幫助我把我要問的保險問題，<BR>轉介給和他們合作的保險專員，讓我從中找到答案。<BR> 步驟是先從平台上先試算出需支付一年保費金額，固定從薪水裡面扣，當然雖心痛，<BR>但靜下心思考，怕有不時之需，萬一意外發生需拿大筆錢出來，這樣子保險就可以多少補貼一點，<BR>負擔一半甚至一半以上，負荷量不會這麼大，真是學到一門課!,7
18047,1521799683498_F01,儲蓄險100萬台幣換美金好嗎?,前幾天去銀行辦事情 銀行專員看了我存摺錢擺了快10年都沒再動<BR>就建議我買個儲蓄險 其實已經建議蠻多次 但是我就是懶 說現在美金很便宜 買到賺到 好像確實有這回事<BR>說實在100萬對我目前而言是沒甚麼會用上拉 單身又住家裡 又是不出門只是無課玩天堂M等遊戲的宅宅 <BR>不過從沒買過儲蓄險這東西 目前也不太想花時間研究 畢竟工作就花不少時間了 在研究個股票基金大概會過勞死<BR>一開始是叫我買類似基金 但是就和剛剛我說的我懶的研究基金 不去研究又怕被坑 雖然100萬用不上但是也不能隨便亂丟<BR>而且我也不想三不五時洗三溫暖看基金漲跌 所以就建議我買儲蓄險美金<BR>然後就換了100W 買了中國人壽美金外幣利率變動型終身壽險<BR>從表格來看兩年以後解約就能拿回本金再稍微多一點 反正我這一百萬也丟了快十年活存 真的沒啥再用<BR>原本說是要買六年 後來我覺得每年都要弄很麻煩 所以直接選了躉繳了<BR>如果10年前有保好像就多了30萬的樣子<BR>不過又常常聽說保險保一保被業務坑殺 感覺怕怕的耶 不知道各位大神有甚麼經驗嗎,7
18101,1521977968255_F01,美元保險,最近美元貶值所以有人推薦買美元保險<BR>30萬台幣折合美金約1萬<BR>投保後，放六年，六年後本金+4%的利息給我<BR>聽起來似乎不錯<BR>還是我應該放定存?,7
18168,1522159913810_F01,疑問 : 解掉A保單買B保單划算嗎 ? (儲蓄險),這幾年來<BR>銀行的行員都會跟媽媽說<BR>這筆錢放到期以後<BR>過幾年等回本就解掉再換買新保單<BR>這樣會越換越好<BR>可是經過自己約略估算<BR>A保單已經放超過6年.每年會配46000+紅利(之前是16000~380000不等.平均約2萬7)<BR>B保單才要剛開始.雖然利率比較高一點但是要大概 17年後保單價值才能超過本來的保單 ?!<BR>根本一點都不划算.<BR>A保單是保誠人壽的.但是銀行行員一直說保誠人壽要撤出台灣了.<BR>所以都會建議客戶改去B保單<BR>B保單是南山人壽佳多利.銀行行員也說要停賣了.但是打去給南山人壽的客服卻說沒有.網站也沒公告說要停賣.<BR>媽媽因為不懂<BR>都只相信銀行行員<BR>所以好幾次都是解掉舊的去換新的<BR>是不是都只是幫銀行行員做業績呢 ?<BR>銀行行員又說可以部分解約A保單<BR>分次投入B保單<BR>是不是真的有那麼需要呢 ? <BR>所以我是算錯了嗎?<BR>還是應該相信銀行行員的話呢 ?,7
18226,1522298295076_F01,請益..美元利率變動保單繳2年或躉繳比較好？,如題~<BR>目前考慮2張保單<BR>台灣人壽吉美鑫美元利率變動型增額終身壽險(躉繳)<BR>台灣人壽增好美美元利率變動型增額終身壽險（2年)<BR>,7
18242,1522324276913_F01,保險問題,30歲的女生買實支實付的保險或意外險，住院險，該怎麼規劃呢？,7
18250,1522329753119_F01,美元保單問題,因美元下跌想用少少的錢去買張保單存筆大金額，因時常有錢就一張兩張股票在買，一直存不到大筆現金<BR><BR>以下是業務員推薦的兩張保單<BR>,7
18251,1522338860889_F01,儲蓄險 保單問題,"<BR>這張保單是之前我爸跟我拿20萬幫我保的<BR>現在保單用不見了,我爸也把保單內容也忘記了<BR>我想請問一下各位大大~~<BR>開始給付年齡85歲<BR>保證期間20年<BR>到底是什麼意思???<BR>保證期間 是要放20年 ?? <BR>開始給付年齡 是要到85歲才能開始領 ??",7
18252,1522340288913_F01,如何給家人多一份保障？,"Hi,各位 <BR>來這尋求一下大家的意見。<BR>簡短的來說 家父是個60歲殘障人士無薪，經濟目前都是我在支持，而我今年30已婚，之前就一直擔心如果我出了什麼事情，我爸就斷了金源，所以問了保險人士 建議我買壽險 <BR>我只希望如果我出了什麼意外 至少壽險可以讓我爸有三餐度日. 請問各位覺得如何？有更好的建議嗎？<BR>",7
18256,1522354369295_F01,一點都不還本的還本險,"很多人買保險總是希望要便宜、保障高、又能夠還本的保險。<BR>我只能跟對方說天下沒這麼好的事，任何東西都是有成本的。<BR>要保障高又能夠還本，那成本一定很高，保費一定很貴。<BR>世界上沒有這麼好的事，有人(保險公司)幫你扛風險，而你卻絲毫不用付出。<BR>(偉大的親情例外)<BR>若有人跟你說，你繳這些保費最後還是可以拿回來。<BR>麻煩請先想想，世上真的有這麼好的事？<BR>要記住，羊毛出在羊身上。<BR><BR>還本其實就是一場謊言<BR>我拿同樣的險種來做比較，下方兩張商品是終身還本意外險與定期意外險：<BR><BR>兩張的差額是：38800 – 980 = 37820 元<BR>那我們將37820放入無風險、利率又低的銀行定存。<BR>假設利率為1.1%，計算20年後可以從銀行領回854,164<BR>比還本型意外險還多領了854,164 – 776000 = 78164 元!!!<BR><BR>我們再計算一下，多出來的利息可以繳交幾年的定期意外險。<BR>78164 / 980 = 79年<BR>也就是說，扣除掉原本繳交的20年保費外，還可以再繳交79年。<BR>也就是說假設20歲投保，需要活到120歲才能划算!!!<BR>(我個人估計我活不到拉，不知道各位是否有自信活的到120歲)<BR> <BR>而且最重要的是會扣除已領取之保險金!!!<BR>也就是說你未必拿的到那776,000元!!!<BR>還在用得到賠給你，用不到還給你嗎？ 醒醒阿!!!<BR> <BR>結論<BR>天下沒有白吃的午餐，保險公司也是一種營利團體，怎麼可能做賠本生意？<BR>真的要理財，請將保障與理財分開進行，越是單純的東西對你會越有利。<BR><BR> <BR>特別註明：由於範例定期險是屬於附約所以會比較便宜。<BR>為了避免失真的情況，把多出的金額除以2，也夠你多用39年。<BR><BR><BR>以上說明與您分享，若有任何不清楚的地方請再來信詢問，謝謝。<BR>需要諮詢請發mail:cdfkt307@gmail.com<BR>或加我的LINE ID：0963099427 <BR>",7
18271,1522388929625_F01,一點都不還本的還本險,"很多人買保險總是希望要便宜、保障高、又能夠還本的保險。<BR>我只能跟對方說天下沒這麼好的事，任何東西都是有成本的。<BR>要保障高又能夠還本，那成本一定很高，保費一定很貴。<BR>世界上沒有這麼好的事，有人幫你扛風險，而你卻絲毫不用付出。<BR>(偉大的親情例外)<BR>若有人跟你說，你繳這些保費最後還是可以拿回來。<BR>麻煩請先想想，世上真的有這麼好的事？<BR>要記住，羊毛出在羊身上。<BR><BR>還本其實就是一場謊言<BR>我拿同樣的險種來做比較，下方兩張商品是終身還本意外險與定期意外險：<BR><BR>兩張的差額是：38800 – 980 = 37820 元<BR>那我們將37820放入無風險、利率又低的銀行定存。<BR>假設利率為1.1%，計算20年後可以從銀行領回854,164<BR>比還本型意外險還多領了854,164 – 776000 = 78164 元!!!<BR><BR>我們再計算一下，多出來的利息可以繳交幾年的定期意外險。<BR>78164 / 980 = 79年<BR>也就是說，扣除掉原本繳交的20年保費外，還可以再繳交79年。<BR>也就是說假設20歲投保，需要活到120歲才能划算!!!<BR>(我個人估計我活不到拉，不知道各位是否有自信活的到120歲)<BR><BR>而且最重要的是會扣除已領取之保險金!!!<BR>也就是說你未必拿的到那776,000元!!!<BR>還在用得到賠給你，用不到還給你嗎？ 醒醒阿!!!<BR><BR>結論<BR>天下沒有白吃的午餐，保險公司也是一種營利團體，怎麼可能做賠本生意？<BR>真的要理財，請將保障與理財分開進行，越是單純的東西對你會越有利。<BR><BR>特別註明：由於範例定期險是屬於附約所以會比較便宜。<BR>為了避免失真的情況，把多出的金額除以2，也夠你多用39年。<BR><BR><BR>以上說明與您分享，若有任何不清楚的地方請再來信詢問，謝謝。",7
18340,1522595640579_F01,這張保單 還要繳下去嗎,請問各位<BR>小弟老婆有張保單 年繳一萬九千多 醫療還本保單<BR>今年第五年 總共要繳15年<BR>今年跟我說不想繳了 我才知道有這張保單<BR>我當下直覺 都繳五年了 剩下我繳好了<BR>問題來了 我本來以為繳滿15年就可以領回了<BR>結果是跟我說 要25年才可以領回<BR>這樣我真的猶豫了 不繳終止合約 只可以拿回4萬九千多<BR>等於損失四萬多塊 但是繳下去 要滿25年 才可以領回<BR>各位可以給個建議 腳還是不繳呢 猶豫中啊,7
18430,1522892128327_F01,請幫忙看看小孩的醫療險有需要更動或是建議嗎,小孩現年4歲女生<BR>剛好先生的保險到期<BR>保險經紀人順便檢視小孩的保險<BR>請各位大大高手幫我看看有需要變動嗎<BR>謝謝<BR>下面是小孩原本保的富邦<BR>富邦人壽防癌終身健康保險附約 PCC1 95年 95年 1單位 1027元<BR>富邦人壽一年定期心安殘廢保險附約 211R 1年 1年 10萬 53元<BR>富邦人壽安心保意外傷害保險附約 MADD 1年 1年 200萬 780元<BR>安心寶意外傷害保險附約意外傷害醫療保險金一般型 NMR 1年 1年 3萬 536元<BR>富邦人壽安心住院醫療定額給付保險附約 HJR 1年 1年 1000元 4280元<BR>富邦人壽新綜合住院醫療保險附約 NHR 1年 1年 30單位 5374元<BR>富邦人壽親子型保險費豁免附約 WPA 20年 20年 436元 <BR> <BR>保險經紀人建議將<BR>PCC1 和 HJR 改成全球的下面這個<BR>全球人壽安養久久終身健康保險(C型) LDC20 20年 10000元 2607元<BR>全球人壽醫療費用健康保險附約 XHR00 至80歲 計畫五 2749元<BR>,7
18434,1522896478262_2_F01,請益保單健檢,這是老公(35歲)的保單剛好最近到期<BR>新光人壽<BR>新防癌醫療保險:個人型 ZB 15年 15年 2單位 1700元<BR>平安意外傷害保險附約 K 75歲 75歲 100萬 0元<BR>意外傷害醫療保險附約 L 75歲 75歲 3萬 410元<BR>綜合保障附約:個人型 P 20年 20年 20萬 0元<BR>住院費用保險附約 N 65歲 65歲 7計畫 0元<BR>下面是保險經紀人推加保的內容<BR>全球人壽<BR>全球人壽安養久久終身健康保險(C型) LDC20 20年 40000元 19835元<BR>全球人壽醫療費用健康保險附約 XHR00 至80歲 計畫五 3449元<BR>全球人壽好安心手術醫療終身健康保險附約(105) XPS20 20年 計畫10 3900元<BR>全球人壽傷害保險附約 XAR00 至74歲 200萬元 1627元<BR>全球人壽個人傷害住院日額保險給付附加條款 XAH00 至74歲 1000元 578元<BR>全球人壽傷害保險醫療保險金附加條款 XMR00 至74歲 3萬元 370元<BR>全球人壽月月安鑫定期保險附約 XFI20 20年期 20000元 1019元<BR><BR>保險經紀人建議如果經濟許可還可以加保<BR>全球人壽月月安鑫定期保險 LFI20 20年期 30000元 18410元<BR><BR>想請問各位大大還有更好的建議嗎 <BR>謝謝,7
18438,1522905361010_F01,保單健檢請益,36歲女生<BR>之前保的保單三商人壽在兩年就到期<BR>三商人壽<BR>祥安終身壽險 20AWL 20年 500000 3000元<BR>新重大疾病終身壽險附約 20NDWLR 20年 500000 3950元<BR>新防癌終身健康保險附約 20NCRC 20年 計畫三*2單位 2414元<BR>意外身故及殘廢保險金 ADDR 至70歲 100萬 1190元<BR>傷害醫療保險金限額--社保型 AMRR 至70歲 3萬 453元<BR>傷害醫療保險金日額 DHIR 至70歲 1000 640元<BR>新住院醫療保險附約 HSRSB 至75歲 計畫B 1430元<BR>日額型住院醫療終身健康保險附約 20HIW 20年 1000 3840元<BR>手術醫療終身健康保險附約 20SIW 20年 1000 1200元<BR>重大疾病及2.3級殘廢豁免保險費附約 20DWPR 20年 14000 92元<BR>98年加保富邦人壽<BR>富邦人壽真享受終身分紅保險(甲型) 20年 10萬 2510元<BR>富邦人壽新綜合住院醫療保險附約 至75歲 10單位 2597元<BR>最近找保險經紀人推薦<BR>全球人壽安養久久終身健康保險(C型) LDC20 20年 40000 17248元<BR>全球人壽醫療費用健康保險附約 XHR00 至80歲 計畫五 4695元<BR>想請問各位大大有甚麼建議<BR>謝謝,7
18605,1523500568592_F01,友邦人壽「友康防癌保險」意見,最近接到友康人壽保險業務的來電<BR>說明這份保單的好處<BR>現代文明病逐日增加，何況癌症機率<BR>原先就有考慮要在今天為自已保份防癌<BR>至少未來有一份保障<BR>這份保單有人有投保嗎？<BR>內容為<BR>只要提供初次罹癌證明相關文件，不用奔波收集癌症醫療費用單據，簡便快速整筆一次給付！癌症給付好簡單！<BR>初次罹患一般癌症一次給付200萬元！男女三大癌症加倍給付，一次給付300萬元！讓您專心治療不擔心龐大癌症醫藥費！<BR>滿期保單仍有效，給付50%累積已繳保險費作為滿期金，可當作出國旅遊、退休基金等，自由運用！防癌最貼心！<BR>身故給付100%累積已繳保險費作為身故保險金，遺愛家人！防癌兼還本！<BR>https://aiadirect.com.tw/ROP50CAN/<BR>目前還在猶豫中,7
18608,1523502204182_F01,請問可以推薦類似郵局六年期吉利保險產品嗎?,"請問可以推薦類似郵局六年期吉利保險產品嗎?<BR>當初購買的郵局六年期吉利保險,這個月到期了<BR>想在去辦理郵局告知已停售了,投保這產品最主<BR>要是想要強迫儲蓄,並不是為了保險(已投保國泰<BR>富邦兩家),這產品是短期可以領回,不用需要10年<BR>或20年.<BR>請問大家有類似的產品可以推薦嗎?<BR>謝謝!",7
18649,1523610416020_F01,關於小小孩的保單規劃問題,最近想幫小孩規劃醫療保單，請富邦專員規劃了一份長照，意外醫療的保單，能否麻煩懂保險的大大們幫忙看一下保單是否完善，謝謝,7
18742,1523933224962_F01,請問保險關於實支實附,買了保險有10年左右了..<BR>針對實支實附來提問..<BR>我有醫療實支實附(限額1萬)+意外實支實附(限額10萬)...<BR>這10年來只有(健保)開刀粉瘤請過保險..也沒多少錢..<BR>都沒用到實支實附這項...<BR>最近又要開刀粉瘤...請問可否運用到實支實附這項..譬如說自費.買藥之類..<BR>不然根本沒作用...<BR>另外剛好有兩顆...醫院規定(健保)一次只能割一顆..如果同一天要處理第2顆要自費...<BR>那我可否自費處理第2顆..再申請保險實支實附....<BR>謝謝,7
18790,1524042092855_F01,請問當兵時 中央人壽鴻福還本終身壽險保單,這邊的一些前輩不知道還有沒有人記得這一張保單<BR>我記得當初 業務來軍中宣導的時候 有說 期滿不解約 領20萬 我最近才發現到好像期滿了 但是怎麼沒有入帳 且繼續扣錢 附約住院日額1655元 上個禮拜 打電話去詢問 那個接電話的還跟我說有這一筆 幫我轉接到給付科 結果給付科 跟我說 我這邊是給付科 跟他沒關係 幫我轉接就直接幫我掛斷<BR>今天有空再問看看 結果今天接電話的跟我說沒有這個滿期金20萬<BR><BR>問下還有印象的朋友 這一張到底有沒有 還是當初業務來為了業績 亂講一通的阿～～<BR>保單正本我一直沒有看過 手上只有什麼 保護條款契約 保護手冊 裡面根本沒有什麼相關的金額東西寫入<BR>稍微查了一下 網路資料 發現滿多人跟我一樣 有在追這一筆 金額 不知道有沒有人同樣當兵時被耍了這一張保單~~~,7
18826,1524124809072_F01,300萬拿去買富邦股票 跟 300萬買富邦保險 哪個賺？,這種愚蠢的行為 4~6年後 哪個比較賺? 〈因為通常保單要綁四~六年〉<BR>我用這句話吐槽把我拉住的業務員 可行嗎?,7
