,id,title,content,cluster
5340,1471537775063_F01,停繳如下保單，請各位堤供意見,X泰人壽<BR>本人：主約：安心住院醫療終身保險(1000元)-已經繳8年(40歲)<BR>附約：全方位傷害保險<BR>全心住院日額健康保險<BR>================================================<BR>其他成員<BR>成員1：主約：新真安心住院醫療終身保險(1000元)-已經繳2年(2歲)<BR>附約：新全方位傷害保險<BR>新好骨力傷害保險<BR>主約：真安順手術醫療終身保險(1000元)-已經繳2年<BR>附約：無<BR>=================================================<BR>成員2：主約：安心保住院醫療終身保險(1000元)-已經繳6年(7歲)<BR>附約：好骨力傷害保險 <BR>主約：安順手術醫療終身保險(1000元)-已經繳6年<BR>附約：無<BR>================================================<BR>如果全部停掉，重新規劃<BR>簡易主約(40歲)<BR>附約：實支實付<BR>定期壽險(300萬)+意外險(300萬) 保證續約<BR>成員1&：成員2<BR>簡易主約<BR>附約：實支實付<BR>定期壽險(100萬)+意外險(200萬) 保證續約<BR>這樣費用多少,7
5344,1471571177422_F01,保險問題請益,"各位大大，我有終生型的醫療險(都是基本單位)，而且是三張終身醫療(南山與中壽)，總保費約月繳3000初，目前已經繳了十年，<BR>在繳十年就可以不用繳了，等於是未來十年還要再繳36萬，目前在考慮是否停繳，改成定期險(有繳才有保)效益與保險額度是否<BR>會比現在的好，請各位前輩建議一下，謝謝。<BR>保單如下：<BR>中國人壽 優活終身醫療健康保險 AHCL 計畫-5 民國98/12月投保<BR>-----------------------------------------------------<BR>中國人壽 樂活終身醫療健康保險 AHRL 計畫-5 民國98/12月投保<BR>附約：新住院醫療限額給付保險 AHSR 計畫-1<BR>-----------------------------------------------------<BR>南山人壽 護您久久終身防癌健康保險 CABAP 1單位 民國96/2月投保<BR>-----------------------------------------------------------<BR>南山人壽 終身醫療保險 20PHIAO 500 民國96/02投保<BR>附約 新人身意外傷害保險 PARA2Q 500,000<BR>附約 住院費用給付保險 HIRE 1,000<BR>------------------------------------------------------------<BR>以上全部費用約3000多<BR>另外去年多保了一份20年定期險如下：<BR>本人71年次的<BR>南山人壽 活力康祥定期健康保險 TDDAR 1,000,000 民國104/09投保<BR>1年需要8900，不知是否太貴。<BR><BR>因目前暫時不想問保險業務(好的業務不好遇到)，怕到時巴著我不放，所以才上來請教各位前輩。",7
5402,1471844881530_F01,BMI32 要怎麼買醫療險,朋友36歲，女生，沒有疾病和慢性病，但過胖，BMI在32左右<BR>之前有買過電話行銷的保單，只有被加費而已<BR>現在如果要重新規劃醫療險的話，哪一間保險公司比較適合?,7
5475,1472095983829_F01,65歲可以買意外險嗎,如題…<BR>公婆年紀已大，沒有任何保險…<BR>身子也不是很好(老人家總是腰酸背痛，感冒之類的)…<BR>買醫療險是不可能了…貴又很多要除外，搞不好還要體檢，最後還不能承保也有可能~<BR>所以想說幫他們規劃一點意外險~<BR>不知道還可以買嗎？~<BR>那一家的可以保到80歲的呢？…<BR>因為有些意外都只保到75而已~~有比較建議的嗎,7
5527,1472359594050_F01,關於儲蓄型保單,最近有想要買儲蓄型保單<BR>問了富邦跟遠雄還有三商~<BR>利率都固定2.25<BR>目前只有富邦是複利計算~都超過2.25<BR>不知道買儲蓄型是否划算,7
5535,1472427939775_F01,有無3年保本又年報酬率1.3%以上的商品,最近剛好有一筆現金入帳，但3年後可能因預售屋交屋需要再評估手中的資產配置，目前看到最保守的定存是台企銀2年期定存1.3%，銀行專員有給南山人壽六年期跟兩年期儲蓄險的報表，但六年期好像要8～9年才會打敗1.3%定存，兩年期更是直接輸給定存（這商品有人會買嗎？懷疑）<BR>是我對儲蓄險認知錯嗎，總覺得儲蓄險只是強迫儲蓄，其實活用性不好、年報酬率跟定存相差不多嗎？謝謝！,7
5570,1472530480778_F01,雙實支實付 與 定期癌險推薦,大家好，本人已經有定期壽險200萬，公司幫投保意外600萬，一份國泰定期醫療(手術1250-8萬)，國泰癌險2單位，三商shsr實支實付，想在為自己多一份實支實付，與定期癌險，請問各位大大有推薦的單，看到很多親友得到癌症，想利用雙實支實付分擔標靶藥物費用，謝謝,7
5578,1472544815480_F01,所以年底前真的要買嗎?保險,https://tw.money.yahoo.com/這3種保險-年底漲價前買-划算-080110200.html,7
5590,1472570847801_F01,保險問題請益: 中國人壽VS遠雄+元大+中國人壽,各位前輩，您們好!!<BR>最近有人建議我的保險可以調整<BR>我看完我原始保險跟他推薦的保險內容<BR>感覺保障給付好像比較好，整體保費有降低<BR>但是還是不懂差異<BR>請各位前輩給予我建議，謝謝!!<BR>=======================================<BR>本人73年次<BR>原始保單內容<BR>契約開始日: 103年01月<BR>保險公司：中國人壽<BR>保險項目險種代碼繳費年限保險計畫龍滿意APGAIC20年期100萬傷害醫療保險給付附加條款MT031年期5萬人身意外傷害住院醫療定額給付附加條款ML031年期計畫-20意外傷害一至六級傷殘補償保險附加條款APAED3單位新樂活終身醫療健康保險BNHRL20年期計畫-20特定傷病終身保險附約(96)FDDR20年期5萬癌症五年定期醫療保險附約(96)FCTR10單位新康泰綜合住院醫療保險附約NCH20單位關心豁免保險費附約(96)FWPD20年期<BR><BR><BR>預計修改保單內容<BR>保險公司：遠雄人壽<BR>保險項目險種代碼繳費年限保險計畫新終身壽險(104)FI120年期10萬新溫馨終身醫療健康保險附約(103)HJ320年期1000康富醫療健康保險附約TJ11年期2計畫一年定期癌症健康保險附約XCD1年期3單位金好心豁免保險費赴約HF120年期22008<BR>保險公司：元大人壽<BR>保險項目險種代碼繳費年限保險計畫祝扶年年殘廢照護終身保險DE20年期50萬祝扶年年殘廢照護終身健康保險附約DF20年期100萬享安住院醫療健康保險附約NR1年期計畫二<BR>保險公司：中國人壽<BR>保險項目險種代碼繳費年限保險計畫人身意外傷害保險CIPA1年期100萬意外傷害重大燒燙傷保險給付附加條款350000傷害醫療保險給付附加條款MT1年期10萬人身意外傷害住院醫療定額給付附加條款ML1年期計畫-20意外傷害一至六級傷殘補償保險附加條款APAED3單位,7
5617,1472648433319_F01,你買的確定是保險嗎？,保險該怎麼保想必是很多人出社會後都曾面對的問題，我出社會後同學來新竹找我賣了一張終身醫療，講了一堆我也聽不是很懂就沒買哈。因緣際會下我也加入了保險業，當時懵懵懂懂的聽到主管跟我說的保險是利己利人的行業(正面表述)就加入了，進入這行業後看著種種的銷售手法，業務自有一套圓滿的說法，結尾統一說法是：總比他都沒保險好吧！如果可以運用有限資金把客戶的風險做“個體最大轉移”是否更完美？這種質問讓我快速成了營業處最不受歡迎的人，因為主管們最害怕業務員知道這樣的真相，保險公司有一個潛規則，商品佣金給得高對客戶就越沒保障（就好比華爾街之狼電影中賣出粉紅單股票佣金高達50%道理一樣），這張股票終將是一張壁紙，保單倒不會變成壁紙至少終身醫療還會還本，當新進業務員觀念如果被導正去賣傭金低的定期險哪麼主管們要賺什麼呢？市場是業務員炒出來的，客人觀念也大多是業務給的，但我離開這麼多年了還是一堆朋友在問我終身醫療業好不好？長照保險好不好？我只回只要很多業務要你買的就是不好！,7
5665,1472790556410_F01,想請各位幫我看看這些保單 是否有需要修改 謝謝,不好意思 想請各位高手 幫我看看這份保單 買好幾年了 <BR>但是感覺費用與保障 不成正比<BR>看是否有需要修改的地方 謝謝<BR><BR>97年11/07<BR>二十年繳費祥安終生壽險(20AWL) 20萬 保費2361<BR>二十年繳費特定傷病中生健康保險附約(20SDR) 20萬 保費957<BR>二十年繳費新重大疾病終生健康保險附約(20NDDBR) 20萬 保費1487<BR>新住院醫療保險附約(HSRSC) 計畫C 保費1364<BR>二十年繳費安康防癌終生健康保險附約計畫C(20ACRC) 1單位 保費3447<BR>二十年繳費好健康終生醫療健康保險附約計畫(20HHIR) 1000 保費6521<BR>二十年安心豁免保險費附約(20CWPR) 33000 保費269<BR>意外身故 殘廢保險金(ADDR) 1級 300萬 保費1810<BR>每次實支實付傷害醫療保險金限額-無社保(AMRR) 1級 50000 保費478<BR>傷害醫療保險金日額(DHIR) 1級 1000 保費322<BR>半年繳保費共19016<BR><BR>100年12/26 二十年繳費新守健康手術醫療終生保險(20NSSI) 1000 保費8570<BR>100年12/26 二十年繳費新真健康終生醫療健康保險(20NJHI) 1000 保費 12370<BR><BR>麻煩大家了,7
5704,1472969733327_F01,保險達人幫幫忙，幫我看下,保險達人幫幫忙<BR>我在2009年因為電話行銷 保了下面這個單子 法國巴黎人壽的<BR>初期保費846 2014年他漲到1161 下面是保的項目 (他每年沒提出就自動續約，應該是定期給付的)<BR>我不清楚這張的效益 我一直以為是意外險，這兩天去查了下，看名字不像是意外險<BR>想問一下 月繳1161 這張保單的CP值高嗎 還是建議更換 換哪種?<BR>我今年37歲 男性 他是不是只能保到65歲?<BR>,7
5716,1473019021803_F01,24歲保險規劃請益,"還沒出社會前(96年)家人幫我保了個南山終身醫療險<BR>不過在上網看了一些資料後 普遍都比較推薦雙實支實付<BR>年薪約五十萬,大約十萬要給家用 <BR>單身 無負債 有抽菸 長期夜班<BR>有哪些險種是我現在必需的? <BR>還有對主約附約的意思不太懂<BR>終身醫療險要減額繳清嗎? 如果不要的話這筆還要繳多久<BR>目前的預算希望一年的保費可以落在兩萬至兩萬五<BR>跪求一份完整的保單<BR><BR>",7
5743,1473089637716_F01,請保險達人協助保單內容，謝謝,25歲 女 服務業<BR>家有一小<BR>個人無任何保險<BR>網路爬文看了一堆，小妹還是什麼都不懂~<BR>也希望幫小孩保保險<BR>小孩預算1~2W<BR>自己2~3萬左右<BR>還請各位大哥大姊有什麼建議和規劃?,7
5769,1473165026335_F01,遠雄保單規劃,"請教各位,此份保單ok嗎?謝謝!<BR>1-超好心殘廢照護終身保險~50萬<BR>2-新溫馨終身醫療健康保險附約~1000<BR>3-新癌症終身健康保險附約~1單位<BR>4-一年定期癌症健康保險附約~3單位<BR>5-綜合住院醫療日額給付保險附約~1000<BR>6-康富醫療健康保險附約~2計畫<BR>7-真安心醫療保險附約~1計畫<BR>8-超級新人生傷害保險附約~50萬<BR>9-實支實付傷害醫療保險金附加條款~5萬",7
5841,1473350425816_F01,家人幫保終身壽險 完全不懂 求救各位大大,各位大大好<BR>在小弟11歲的時候(民92) 奶奶幫我買了兩份保險<BR>一個是「南山九九終身防癌保險」<BR>一個是「南山新康祥終身壽險-c型」<BR>過去奶奶只和我說 保20年後可以領回<BR>當時的我懵懵懂懂 沒有過問<BR>長大後 也是每年固定把2萬多塊的保費交給奶奶 沒有想太多<BR>時至今日 我才突然意識到 我保的是什麼? 真的可以領回嗎? 我完全搞不懂阿<BR>問了奶奶 結果一問三不知 只是一再強調可以領回<BR>後來和奶奶拿了保單看看 也上網查查 還是毫無頭緒<BR>所以拜託大大幫忙回答幾個問題<BR>以下是小弟兩份保單內容<BR><BR>以上為「南山九九終身防癌保險」<BR><BR>以上為「南山新康祥終身壽險-c型」<BR>大大們<BR>請問 我這兩份保單 期限真的都是20年嗎? 為何有59年的= =?<BR>請問 繳完20年後 真的可以領回嗎? 還是要等我過世之後?<BR>(上網查了一下 好像是領回解約金的金額? 保單上寫20年22萬 就是繳完20年可領回22萬嗎?)<BR>請問 如果我繳完20年 不領回保費也不繼續繳 我可以享有什麼保障? 終身得癌有錢領嗎?<BR>請問 保單上寫的減額繳清和暨展延期是什麼意思?<BR>不是繳完20年就可以享有保障了嗎? 為何還要延期?<BR>希望大大們解答可以盡量簡單白話一點 因為小弟對這方面是一竅不通<BR>感恩感謝各位大大~,7
5856,1473414142859_F01,家庭保險在香港買還是台灣買,hello 各位大大<BR>因為我們一家目前在北京生活<BR>但又想為一家人投保重疾保險和壽險<BR>然而北京沒有台灣的保險公司<BR>相對香港的保險公司倒是有不少<BR>保險產品比大陸的條款保障要成熟一些 <BR>兒子未來可能要去台灣上學<BR>不知道是該怎麼買保險了<BR>現在看了香港保誠的孩子的重疾險<BR>80萬人民幣七次給付 一年1880美金<BR>不知道相對保險市場也很成熟的台灣是不是一個好的選擇<BR>求指教，謝謝！,7
5981,1474000864515_F01,600萬投入年金險，一個月可領多少？,有一樓在談以房養老，是600萬。<BR>想到如果用600萬投保保險公司年金險，一個月可以領多少呢？保險公司年金顯好像是20年？<BR>知道的請談談。,7
6020,1474245662006_F01,租屋者建議投保居家保險嗎？,租屋者建議投保居家保險嗎？<BR>必要性跟保障為何?<BR>有無推薦任何保險公司的方案<BR>謝謝,7
6028,1474272988135_F01,請教一下 美金儲蓄型保單,請教一下各位，最近朋友介紹一張保單，南山人壽金利久久美元利率變動型增額終身壽險(定期給付型)，<BR>年繳約4200美金(約台幣13萬)，宣告利率3.6%，<BR>如附圖，第一次買很猶豫，請各位幫忙看看，有什麼問題。,7
6040,1474291078377_F01,健康保險規劃建議,有家庭的人只有健保夠嗎？<BR>有哪些醫療狀況是健保不夠支付的?<BR>除了健保，建議加保哪些保險呢？<BR>常見有意外險，長期照顧等等，<BR>聽聽大家看法,7
6119,1474585465021_F01,保險跟收入的比例,"保險跟收入的比例，有些人大概是10：1～15:1,<BR>請問大家會包含健保，汽機車險，商業保險，等等嗎？<BR><BR>聽聽大家分享",7
6127,1474603417444_F01,英文保單看不太了解，請大家幫忙,英文保單看不太了解，請大家幫忙<BR><BR>謝謝,7
6153,1474733014669_F01,合作金庫人壽超優退保險有人有研究嗎?,合作金庫人壽超優退保險<BR>我算了一下約6%多<BR>感覺不錯~有人有研究嗎?,7
6194,1474954103079_F01,如果你有人生的第一個300萬 你會怎麼使用？,股票<BR>房地產<BR>定存<BR>保險<BR>還是其他呢？,7
6196,1474956818003_F01,郵局常春增額還本6年期,有關郵局常春增額還本6年期<BR>以35歲<BR>常春增額還本6年期(10萬1單位)<BR>保額20萬<BR>保險期間至78歲<BR><BR>繳費期間 每2年 領百分之6趴 (1萬2)<BR>6年繳費期滿後 每年領百分之6趴(1萬2)<BR>我想請問我算了一下<BR>我以月繳8818折88元8730元去繳費<BR>6年我一共(月)繳了628560扣掉還本金額...<BR>如果以單存錢角度<BR>我是不是要放10年才算保本領回.<BR><BR>煩解 感謝,7
6216,1475051885128_F01,國泰壽險請教,小弟今年20歲，下列保單已繳一年，由於當初是家人幫我保的，所以沒什麼研究<BR>最近手頭緊，想看看能不能有節省保費的方法。<BR>1. 國泰人壽鑫彩終身壽險(10萬)<BR> 附約(國泰人壽新全方位傷害保險附約)(1000)<BR> 附約(國泰人壽新真全意住院醫療健康保險附約)(M10)<BR>2. 國泰人壽新真安心住院醫療終身保險(1000)<BR>3. 國泰人壽真安順手術醫療終身保險(1000)<BR>我本身做汽車美容，應該不算危險，身體也不錯，畢竟還年輕.. 最大的風險就是每天騎機車吧!<BR>請問這些保單需要做更改嗎? 有沒有重複不需要的部分，我看得懂條款，但是感覺保險很多文字遊戲，我怕會有什麼陷阱<BR>或是哪些可以建議改成產險的嗎?比如說手術?聽說產險的手術理賠項目較齊全?<BR>看01說 國泰最愛賣的保單，我都買了...<BR>真的有這麼差嗎?<BR>謝謝!,7
6218,1475063671859_F01,有六年期儲蓄險可以推薦嗎？,"目前手上有新光的【增有利】，六年期滿之後，如果不解約繼續放著，大概是年利率2.25%，這樣算好嗎？<BR>之前是把投入的錢跟銀行定存（當時是1.37%）比較，覺得好像不錯。<BR><BR>不曉得有沒有更好的標的可以提供，謝謝囉！<BR>20160929 更正<BR> 謝謝大家指教, 小弟用詞錯誤, 真是抱歉了~ 應為儲蓄險才對, 而非投資型保單",7
6323,1475583887498_F01,尋求英語能力好的保險業務,尋求英語能力好的保險業務<BR>歡迎私訊或留言,7
6341,1475650528698_F01,到香港買保單---英國保誠(雋陞)或友邦人壽(充裕未來),在台灣已經買了一些躉繳的台幣及美金儲蓄險，比來比去IRR就是這樣，近期規劃到香港以美金購買英國保誠(雋陞)或友邦人壽(充裕未來)的儲蓄計劃，請問有前輩可以分享經驗或購買通路嗎?<BR>---購買境外保單的風險在板上之前已經有其他討論，見仁見智，請前輩們不必再對此著墨,7
6362,1475739539736_F01,請推薦保險,請問有歸還本金的保險可以推薦嗎(我以前的認知那是壽險還是儲蓄險 但是十幾年前了 現在情況不知是什麼 還是叫壽險嗎)<BR>想幫自己和父母保<BR>都希望能還本而且有醫療或生活保障的<BR>自己年齡37<BR>父母年齡剛過65<BR>有在考慮郵局的<BR>但還是想多比較一下<BR>謝謝<BR>我的預算 三個人 每年保費希望三人合計加總控制在三萬左右<BR>(因為我自己已經有一個繳了十幾年的保險..現在還在繳當中...想說不要增加負擔太多)<BR>另外針對父母部分 有短期型 第二年就開始可以月領回的嗎..想增加父母的每月零用金<BR>另外我希望能在本樓做討論 也請懂的人一起幫我看一下<BR>有來私訊討論的 我應該就不私訊回覆了(您可以發私訊建議我 但我會針對貴保單名稱在樓上提問題--只針對保單--不對人) <BR>謝謝,7
6440,1476166205341_F01,懇請幫忙分析保單,"不好意思大家<BR>小弟最近得知母親朋友的兒子幫家母保了2張保險(友情保),分別是一張壽險跟6年美金儲蓄險,其他通通沒有(母親已經52歲了)...<BR>我們家對於金錢理財很單純保守就是放銀行跟郵局而已,家裡也並非小康但生活就還過得去就是了<BR>這兩張保險已繳2年了..自己試算一下6年美金那張IRR...但又怕算錯(自己也沒保任何保險..)<BR>家裡對保險又都是外行人,對於美金儲蓄母親總說自己有閒的資金,而且也不好意思拒絕,但是我知道他所謂閒的資金就是銀行那些錢..6年繳完應該戶頭也所剩不多<BR>我自己在想是否要把美金儲蓄減額繳清,然後保其他醫療險.意外險等..雖然知道母親這年紀買很貴..<BR>實在很煩惱,深怕亂買保單會造成不必要的後果<BR>懇請大家幫我看看 還有算算IRR<BR><BR><BR><BR><BR>美金儲蓄險<BR><BR><BR>主約壽險+附約實支實付而已..",7
6441,1476168896471_F01,美元保單,"請問6年期的美元保單,是在到期的那一年 可以領出,還是要等第7年呢?還有領出是不是要扣保單的費用?",7
6487,1476348947759_F01,"大家好~想請問有保遠雄人壽~醫療險~與富邦人壽的前輩們~已補上富邦人壽,謝謝前輩們指教~","各位前輩大家好~小女子~今年30,想為自己投保一份醫療險~為以後多保一層保障<BR>可是醫療險項目林林總總一堆,每家公司都不一樣~<BR>親戚介紹遠雄人壽說不錯~下面是遠雄規劃的醫療險<BR>F11 遠雄終身壽險(104)-----年期:20年---單位:10萬----保費:2,510<BR>RHA 遠雄傷害保險 -----年期:1年期--單位:100萬---保費:810<BR>MRC 遠雄實支實付 -----年期:1年期--單位:5萬-----保費:687<BR>RHG 遠雄日額給付 -----年期:1年期--單位:1000元--保費:550<BR>HG4 遠雄新癌症終身健康--- 年期:20年期-單位:1單位---保費:4,102<BR>HJ3 遠雄新溫馨終身醫療----年期:20年期-單位:2000----保費:22,020<BR>RSM 遠雄好安心住院醫療----年期:1年----單位:1計畫---保費:3,251<BR> 總計:33,930<BR>富邦的<BR>富邦人壽傷害保險附約---------------年期:1年-----保額:100萬----保費:1,180<BR>富邦人壽新平準終身壽險-------------年期:20年----保額:10萬-----保費2,640<BR>富邦人壽安心寶貝終身建保險----------年期:20年----保額:2000----保費:29,100<BR>富邦人壽每次傷害醫療保險金限額------年期:1年------保額:5萬-----保費:436<BR>富邦人壽傷害醫療保險金住院日額------年期:1年------保額:1000----保費:507<BR>富邦人壽新終身防癌健康保險附約------年期:20年-----保額:1單位----保費7,007<BR>富邦人壽新住院醫療定期健康保險附約---年期:75歲滿期--保額:1單位---保費:7,223<BR> 總計:48,093<BR><BR>想請問各位前輩~有沒有需要注意什麼的~因為第一份醫療保險~上網查了好多資訊~看的頭昏<BR>先謝謝各位前輩指教~",7
6496,1476376688496_F01,年報酬率2%的儲蓄險保單或保本的投資?,"目前手邊有150萬的資金,請問板上的大大可以介紹報酬率接近2%且保證保本的投資方法嗎?<BR>躉繳的儲蓄險目前市面上有三年期或六年期,報酬率最高的保單是哪一張?<BR>查到網站裡面的介紹 : https://my83.com.tw/blogs?p=1342<BR>感覺都蠻低的?",7
6515,1476514133514_F01,請問B肝帶原者購買實支實付醫療險，一定會被加費嗎?,請問B肝帶原者購買實支實付醫療險，一定會被加費嗎?<BR>目前有向新X人壽購保，於核保階段，被告知要加收20%保費<BR>體檢的數值均在正常範圍....<BR>所以，只要有B肝帶原，儘管體檢正常，保險公司均會以加保費承保嗎?<BR>還是說只有新X人壽的作法是這樣呢?,7
6522,1476584474494_F01,以前的儲蓄險有比較划算,現在的儲蓄險那麼多<BR>每個保險業務都講得那麼划算<BR>一定要為自己做一些退休準備<BR>可是事實上很多人保了就後悔了<BR>應該不划算<BR>可是很久以前儲蓄險就存在了<BR>以前的利率多好？<BR>有沒有人十幾年前就開始儲蓄<BR>現在已經在領了<BR>可以分享一下,7
6534,1476674488793_F01,請教一下，我的遠雄儲蓄險解約,"我第一年繳完，現在不想繳了(錢另有用途) <BR>問我的保險經紀人說遠雄公司來電說第一年解約沒解約金<BR>(問我是否要解約) <BR>可是我看解約表第一年解約 7万5, 解約金大慨還有4万多<BR>所以想請問一下了解的人 謝謝",7
6548,1476710563821_F01,請問醫療險,"小弟目前本身 已買了三商的儲蓄險以及防癌險<BR>最近有接到玉山客服電話推銷 康健人壽-家有意保 http://www.cigna.com.tw/TopProducts/PAR<BR>如果今天在電話中答應的話, 保單如果寄來 是不是有7~14天時間能夠退呢?<BR>請問各位 這張保單值得買嗎?<BR>這張是15年, 滿期後可領回6成<BR>1個月1300左右繳15年= 234000<BR>滿期可拿回十幾萬<BR>如果途中有住院過, 有領理賠保險金<BR>滿期後也是可拿到十幾萬, 不會因為有領過而扣掉<BR>我這樣打, 會看得懂嗎",7
6559,1476759945911_F01,保單還有在賣嗎?,2年前<BR>版上有位熱心保經幫我規劃了一份保單(醫療險 癌症 意外 殘扶)<BR>但後來就連絡不上了<BR>想請問 這些保險還有在賣嗎 <BR>--------------------------<BR> 險種 保額 年保費<BR>全球 NPH 200/日 3574<BR> XHR 計劃四 2944<BR> 險種 保額 年保費<BR>中國信託 QLPB 10萬 3600<BR> HNRB 計劃二 4463<BR> 險種 保額 年保費<BR>富邦 XWO 10萬 3880<BR> NHR1 15單位 4582<BR>-------------------------------<BR> 險種 保額 年保費<BR>法巴 金健康三 100萬 5900<BR><BR>----------------------------------<BR> 險種 保額 年保費<BR>華南產 意外險 500萬 3057<BR>BEST專案<BR>---------------------------------------<BR> 險種 保額 年保費<BR>友邦 JTL(10年期定壽) 100萬 5280<BR> YRDR 500萬 4400<BR> <BR> <BR>,7
6649,1477189719623_F01,第一次買醫療保險 請大大幫我看下我的保單,<BR><BR>小弟買保險的總要目的是 怕意外傷害 和癌症<BR>一年差不多要繳36000左右<BR>請問小弟這分的醫療保單 有多保或少保的地方嗎？,7
6653,1477232991772_F01,請問這兩張新光還本儲蓄險怎麼選擇好？,請問以下兩張儲蓄險保單，各位會推薦哪張？<BR>新光人壽大好利率變動型終身還本保險 (限女性)<BR>新光人壽鑫利雙喜利率變動型終身還本保險<BR>謝謝！,7
