,id,title,content,cluster
13452,1504488736210_F01,富邦vix,請教一下板上各位大大<BR>我知道vix是反向etf<BR>上周末金小胖試核<BR>假如我預設明天美股小幅度向下<BR>購入富邦vix是不是正確<BR>其實這檔蠻複雜的<BR>我只知道做反向美股就買這支<BR>然後不適合長期持有<BR>有在研究這檔的前輩嗎？,5
13547,1504775903205_F01,安聯收益成長基金(南非幣避險)年配息17%,聊聊安聯收益成長基金 ，有人買這支嗎？我有入手一點安聯收益成長基金(南非幣避險),5
13581,1504860036812_F01,請問2367 耀華可以買嗎?,"燿華 106年8月營收14.59億、年增19.34%<BR>營收創下歷史新高, 股價還在低檔<BR>這支建議買進嗎??",5
13583,1504866291377_F01,6180傷心文,"平常沒有在玩股票，兩個月前才想說要買6180遊戲橘子十張(當時3x元)<BR>因為之前暗黑破壞神三上市的關係，心想很有把握會漲價<BR>結果要下單的時候又沒甚麼勇氣，如今股價已經6x元了<BR>現在進場有點危險再加上也買不到了<BR>害我兩天耿耿於懷,好難紓解這個情緒....<BR>不知這支股票後續怎麼看？放眼台灣市場之後應該沒有遊戲可以有這機會了",5
13618,1505051612448_F01,6150撼訊 營收連三個月暴增,這支好像業績開始轉好<BR>這個月又創近期新高<BR>況且在4~5月稅後虧損0.03情況下 第二季單靠六月營收<BR>可以變成賺0.98 可見6月單月賺有一塊錢<BR>已經連三個月營收都4億以上<BR>可能會是下半年大飆股<BR>不過籌碼有點亂,5
13714,1505381605861_F01,3323加百裕,"3323加百裕<BR>這支最近搭上電動車題材,加上今年開始獲利很好,<BR>感覺股價應該不只這樣",5
13796,1505711307669_F01,3346麗清,底部打底上禮拜突破震盪中<BR>這支有人研究嗎？,5
13849,1505894288372_F01,乙盛可以買嗎,乙盛ky這支股票能買嗎 ？有大大可以建議的嗎,5
13980,1506319885578_F01,沒想到最低價的華映 竟然是獲得報酬率最高的,當初想說 這支最低 1.4 能在低到哪邊去 果然漲了一倍後 看起來還是很低,5
13991,1506345973031_F01,3413京鼎 跌好快好深,雖然知道大盤準備下跌，<BR>但這支基本面不是還不錯嗎，<BR>為什麼跌那?多，<BR>該停損嗎，買在219,5
14135,1506999572686_F01,有人注意這支嗎?,有人看聯上發這支嗎<BR>蠻便宜的<BR>利多也不少<BR>為什麼股價一直這麼低呢?<BR>,5
14142,1507026561210_F01,5515 建國 大家想法~,小弟我在這幾天買了這隻建國 5515 看起來主力 還在雖然有一直不斷有人了解 但是主力 以及三大法人目前持有股票都還蠻穩的<BR>想問問大家覺得這支股票如何 有沒有機會衝上. <BR>我是在11塊買的 10/3 小漲3.74% 交易量4710感覺不錯<BR>大家想法是?,5
14221,1507389668557_F01,台勝科討論,有人手上還有這支嗎?<BR>後續走勢怎麼樣<BR>期待又怕受傷害。,5
14224,1507425517124_F01,對於4915致伸討論,對於致伸這支牌看好嗎？undefinedundefined,5
14228,1507457026354_F01,分價量表,分價量表(灰)可得知這支股票的壓力價與支撐價<BR>股價在灰線下，代表灰線是壓力價<BR>股價在灰線上，代表灰線是支撐價<BR><BR><BR>,5
14291,1507776525531_F01,2208台船,這支有人買進嗎<BR>好像一直虧錢<BR><BR>買個幾張<BR>賭看看<BR>大家覺得?!,5
14379,1508119069760_F01,5426振發 今天在漲什麼??,如標題<BR>有關注這支的朋友們知道嗎???<BR>突然來個接近漲停,5
14400,1508157638578_F01,聯邦銀 2838,最近股市越墊越高 心裡總是不太踏實<BR>最近把一些股票獲利了結後 加碼聯邦銀<BR>也跟著認了一些聯邦銀甲特 個人觀察這支<BR>根本台中銀翻版 看看台中銀那陡峭的月線<BR>這支似乎是不錯的選擇 就等突破站穩不回<BR>EPS近年大概都1-1.2遊走 獲利能力還可以<BR>最近外資持續買 大家怎麼看？<BR><BR><BR>,5
14508,1508686444770_F01,買進茂達6138（純粹個人投資，盈虧自負）,這支不錯，業績也很好，有興趣的朋友可以研究研究<BR><BR>,5
14545,1508829557169_F01,【請益】長榮最近大漲的原因？,在最近這兩個交易日，長榮的漲勢相當驚人<BR>雖然有要辦現金增資，但也不是什麼利多<BR>第三季營收一月不如一月，財報或許不錯看，但還要半個多月才開<BR>而且運價報價直直落，到底是在漲什麼？<BR>這支是不是被玩爛了？,5
14683,1509360985162_F01,5G概念股環宇,毛利高達5成，環宇在5G具有優勢，目前5G有二個主流，分別是磷化銦和氮化鎵，環宇與日本住友是全球唯二作磷化銦的HBT，且已可以量產。同組群今年有些漲幅還真多，這支卻上沖下洗還在原地混。難道又是F股的宿命嗎？,5
14871,1510097175403_F01,請問群聯8299後續發展,觀察很久 遲遲未進場<BR>群聯為nand flash的大廠 以後的ssd也都越做越大 包含手機容量<BR>今年股價最高到450目前回測350 今年至今賺22塊多 預估整年可達30塊<BR>歷史高價在700元 想請問目前有辦法進場嗎？<BR>高價股漲跌很嚇人 但本身看好群聯後續發展<BR>觀察到這支也幾乎都是外資擁有 有人可以用版上那個程式看目前主力成本嗎？<BR>感謝,5
14980,1510564442846_F01,請問大家怎們看TPK-KY(宸鴻) 這支股票,大家怎們看這支股票啊感覺一直往下跌~小弟感覺在高點(106)進場看一直往下跌今日收盤(80)<BR>不知道要繼續放者 還是要認賠出售呢? 很疑惑,5
15039,1510683549233_F01,增你強3028 為什麼一直漲？,大概17塊買的 現在賺11%了<BR>因為搞不懂為什麼它一直漲？<BR>所以想續抱又覺得怕怕的<BR>網路上也找不太到一直漲的原因 <BR>連新聞都很少 所以這支只是因為題材對了漲上來的嗎？我該跑了嗎？,5
15080,1510842358186_F01,"想請問大家,台積電這支股票好嗎?","我覺得這支股票是績優股,不知道大家的看法如何?",5
15081,1510843628101_F01,"請問一下,真的有人把第一金當定存股嗎?","有認識的介紹說這支股票每年會配股配息,可以當定存股,但是最近好像有負面消息,我買了8張,套牢中,這支適合做長期投資嗎?",5
15095,1510896473165_F01,5536聖暉,"這支大家看法如何?<BR>http://www.chinatimes.com/realtimenews/20171109005985-260410<BR>說<BR>""2017年11月09日 19:54 工商 曾麗芳<BR>無塵室機電整合工程大廠-聖暉工程（5536），今（9）晚公布前3季稅後淨利6.36億元，暴增近1倍、達96.1％，EPS高達13.73元！""<BR>聖暉在手訂單逾100億<BR>https://money.udn.com/money/story/5710/2765061<BR><BR>聖暉小金雞：朋億亮相興櫃<BR>https://udn.com/news/story/6850/2213548",5
15122,1510971151470_F01,宏普(2536)問一下，這支好嗎,宏普(2536)問一下，這支好嗎,5
15170,1511154382819_F01,國統，可以攤平了嗎?,<BR>想攤平這支，<BR>但沒買到15.7的價位，<BR>不知道還有沒有機會下探15元<BR>當初這檔買的有點高，<BR>沒想到續跌<BR>重點是今年竟然沒發股利..<BR>明年有點危險,5
15190,1511239438285_F01,4938和碩,這支也跌一大段了<BR>考慮買個幾隻來玩玩<BR><BR>有人進場了嗎<BR>,5
15243,1511393341134_F01,嘉晶(3016),這支有人買嗎?<BR>跟上矽晶圓 買了晶元還不錯<BR>但嘉晶(3016)沒買 最近想買還來得及嗎?,5
15339,1511786091915_F01,6573 虹揚-ky,這支有人在觀察嗎？<BR>有人說會破前高但最近籌碼跟走勢好像都沒有很好,5
15467,1512201729532_F01,興櫃普生近日出量大漲，請問有人知道為什麼嗎？,我因為看電視媽媽好神有在屈臣式買oh care漱口藥水，覺得很好用。發現這是普生的產品，這幾天漲不知是康聯概念股還是因為跟克堤合作的關係？有人對這支股票有研究嗎？感恩！,5
15503,1512366390455_F01,中光電5371手上現金比現在市值多,"小弟最近買入這支,買入原因是這支現金及約當現金152億台幣,市值不到150億<BR>也就是公司手上現金能買入流通在外的股份<BR>這隻背光模組營收越來越低(10月背光模組營收不到10億)<BR>覺得這支被嚴重低估,現在價位也滿便宜的,給大家參考<BR>",5
15537,1512482763623_F01,4919新唐 各位有研究嗎,新唐這支股票<BR>上禮拜四老婆買了11張72元，<BR>結果從上禮拜五到現在只剩64元，<BR>一下就噴了八萬多元，<BR>因為對研究股票不是很了解<BR>想問各位，這間公司狀況還可以嗎<BR>繼續留著還有機會回去嗎,5
15681,1512922440764_F01,天堂M 12/11開服前夕，預測一下6180橘子本月營收吧？,版上關注這支股票已久，多空論戰皆有，天堂M今天正式開服，有玩家或專家可以預測一下橘子12月甚至明年第一季的營收嗎？之前曾看過一份投資部門內部的研究報告，預估的數字非常非常...樂觀，但是心裡總是有點懷疑，股價也大幅波動。本以為12/11開服會開始拉回修正，沒想到12/6關禁閉結束後先跌停兩根，週五又迅速漲停，多空都很難操作。<BR>前幾天看到他的可轉債CB尚未轉換的餘額只剩下420張，也就是說尚未轉換成橘子現股的張數約只有1050張，若非有人轉換後不還券，那就意味著現在的空單都是實空而非虛空的套利鎖單了？看來多空爭霸還有好戲可看！,5
15767,1513266799278_F01,興櫃股 州巧,這支在漲什麼？ 有什麼好消息嗎？,5
15815,1513470367738_F01,智捷..........,"上星期觀察了一下<BR>就出手,主力有再買<BR>不知道大家有注意到這支嗎",5
15905,1513833769298_F01,紘康這支有潛力嗎？,最近朋友推薦這支股票，但很少看人在討論，想請教各位先進的看法？給新人一些指導。謝謝！,5
15934,1513968198020_F01,台新智慧生活基金,這支新的股票型基金<BR>不曉得適不適合長期定期定額投資呢？<BR>亦也有美元及台幣計價,5
15940,1513995185481_F01,好股不寂寞--致茂(2360),"最近看到此支股票,發現很多明星產業都和這支有關係,產品都是客製化,毛利率高,半導體-AI,3D感測及電動車..等,元月9日CES展概念股,現在台股回檔整理中,一些價值展望佳的個股,似乎有點加溫的態勢,這支法人持股高,散戶興趣缺缺,在台股那麼多股票,這支的吸引力,CP值說真的還真高,大家可以討論討論",5
16167,1515036624421_F01,大家可以幫忙看一下九豪這支嗎,本想電動的方向已經確定了，未來需求最大的電池應該很有投資前景吧！<BR>之前有再看九豪這支，是做陶瓷基板，跟電池有關<BR>不過最近突然一直在飆升，以前剛看的時候還只有13-14再遊走<BR>不太明白，為什麼會升那麼多呢<BR>有大大能解惑嗎,5
16177,1515046492365_F01,8121越峰 有人研究嗎？現在還能進嗎？,有人看好這支嗎？前高32有機會突破嗎,5
16228,1515242085414_F01,開始殞落的股王...3008,很久沒看這支了.....<BR>我估的合理價還不到2千<BR>本夢比推到5千<BR>看來還有得跌<BR>雖然是好股<BR>但5千真得太高<BR>現在還有4千...<BR>各位高手有甚麼高見<BR>歡迎討論,5
16235,1515269684029_F01,8358金居,"這支我從58空到40出場,38又去空一路被嘎到現在的42.8！有人也玩這支嗎？",5
16364,1515763556133_F01,1611中電，今天爆了超級天量...這是什麼情況??,平常成交量大概都幾百張，今天卻爆了4萬多張的天量，今天漲停卻沒守住，但尾盤也是收中紅，請問這支股票適合買進嗎??它好像在去年底轉虧為盈，你們有買這支嗎?有何看法..謝謝...,5
16374,1515849988597_F01,挖掘到的定存好股，現在上車，10年後報酬率破100%不是夢,大家好 打嘎賀 泰嘎賀<BR>本肥宅魯蛇在此跟大家說個晚安<BR>最近三個月本肥宅仔細觀察到的一直非常低調的好股票<BR>該家公司有在賣麵粉 義大利麵 小麥粉 米穀粉<BR><BR>猜到了嗎<BR>沒錯<BR><BR>就是-聯華(1229)<BR>不要像肥宅我一開始把她跟聯華食品 搞錯阿啊!!!!!!!!!!!!<BR><BR>聯華實業(1229) 在近10年<BR>連續發放股利沒間斷<BR>而且近 6 年填息率 100%<BR>沒錯<BR>100%填息<BR>可說是「定存股」的模範生<BR><BR>股價表現上，聯華今年已漲超過 50 %<BR><BR>而且非景氣循環股<BR>而是民生必需股<BR>這支股票<BR>也是繼 亞泥 之後<BR>本肥宅力推的第二檔優質定存股<BR><BR>想成為台灣巴菲特嗎<BR>想要年報酬率18%嗎<BR><BR>那就聽哥哥的話<BR><BR>趕快上車囉,5
16380,1515900244675_F01,2038海光,2038海光，這支小型鋼鐵產業，接下來還有會攀升嗎？,5
16446,1516226268220_F01,請問有人買三商的「美昇發美元終身保險」美,因為本人現在25歲 不是很懂這些理財的<BR>只想穩穩的存錢<BR>有業務員推薦我買三商這支存美金的<BR>年繳72620台幣 說存20年後可以領回兩百萬左右<BR>當然每年也可以領回一些錢<BR><BR>想請問大家覺得可以買嗎,5
16526,1516529684867_F01,2328 廣宇 2017營收年增近四成~(摘自新聞),"這支股票看了很久~ 近期都在25.35~26.6 徘徊. 算是打了超過一年超級大底的股票. <BR>2017營收年增近4成. 夏普銷量也不錯,加上近期群創面板開PARTY~ 鴻海外資也開始回補. <BR>不知道禮拜一開工有沒有機會帶動一下~ <BR>暫時看起來是不錯~ 有間外資持續加碼中.大戶持股比也是連續三周上揚~<BR>就先列入觀察一下囉~ <BR><BR>夏普訂單加持，廣宇去年營收大進補，年增近四成<BR>http://news.sina.com.tw/article/20180115/25419692.html<BR>夏普銷量飆 廣宇群創沾光<BR>https://money.udn.com/money/story/5612/2919198",5
16645,1516961797689_F01,【中磊 (5388)】5G網通概念股有人在研究這隻冷門股嗎?,有人在研究中磊 (5388)嗎?<BR>因這隻每天的交易量都好小，<BR>頂多業績好的時候，只有投信在買賣而已，<BR>雖然是網通廠，也有涉略些5G概念、智慧家庭、小型基地台..等等，<BR>看每年業績是有穩定再成長的，<BR>不知道是否也有大大可以一起分享這支5388中磊。<BR>謝謝大家<BR><BR><BR>,5
16647,1516963059832_F01,【微星2377】為啥可以漲到96元，太誇張了,請問各位大大，<BR>2377微星每年是有再成長的，<BR>也是電競第一踏入的先驅，<BR>不過近期股價越來越強，已經到了96元了，<BR>大盤再跌，2377也是一枝獨秀，<BR>為何外資在大盤跌的時候一直狂買微星?<BR>是要準備破百了嗎?<BR>這支還可以入場嗎?<BR>感覺7x的價位等不到了?!<BR><BR><BR>,5
16653,1516969702214_F01,未上市上櫃，萬寶祿生技,最近一直接到某投資顧問公司<BR>在推銷這支股票。<BR>有人有研究嗎？,5
16768,1517493251798_F01,矽格6257，這隻股建議長期持有嗎,肥宅我之前無聊<BR>本來只投資前百大上市企業<BR>而且偏重傳產跟金融股<BR><BR>結果四個月前手癢<BR>在家隨機把幾個科技股當成飛鏢來射<BR>看射到哪支就買哪檔<BR><BR>結果射到矽格這支 隨便買了三張<BR><BR>結果這兩個月<BR>是我所有持股中表現最好的<BR><BR>短短四個月 報酬率超過13%<BR>嚇到我吃手手<BR>但是因為對這支科技股不熟<BR>所以想知道<BR><BR>有大大們知道這支可以長期持有嗎<BR>還有看好他的後續嗎??,5
16859,1517839166808_F01,大家手上持有什麼稀奇冷門股，連聽都沒聽過介紹一下,俺的冷門股3085新零售，蠢蠢欲動 ?<BR>要你二根長棒來不來，擦亮眼等等等<BR>搏第二季能否轉虧為盈？啊係..<BR>市場布局完成有朝一日成妖股 績優股 ？<BR>好股那麼多一定要這支嗎 死忠？<BR>不要等到花兒都謝了 抱抱抱,5
16931,1517914790740_F01,50反1,朋友抱這支很久了<BR>一直相信<BR>「股票崩盤就能賺大錢」<BR>近日股災讓他超興奮<BR>也想再投錢下去<BR>只是我看了許多文章<BR>很多都說<BR>這支「不適合」長期投資<BR>更有人說<BR>這支是「期貨」<BR>想問問各位<BR>以目前情況<BR>該繼續投資嗎,5
16935,1517918301254_F01,關於0050反1,請問這支融券賣出有回補日嗎？<BR>如果沒有我就放著當長期投資了,5
16940,1517926552327_F01,有人跟我一樣抽中...鎧勝-KY(5264),"好不容易抽中了這支鎧勝-KY(5264)<BR>結果不幸遇到股災.....<BR>從賺錢轉眼都要變成虧錢了!<BR>之前有看到某些股票..如果發券前幾天跌破承銷價...就會取消!<BR>看到有6800張,應該會有不少受災戶吧!<BR>明天如果再跌就破承銷價了!<BR>有辦法自救嗎?",5
16999,1518061310621_F01,6120?運可買嗎?,"最近這二天每一支外資都在倒貨,<BR>但這支6120外資不但沒賣,<BR>反而反其道而行,一直大買<BR>不知可否可跟進?",5
17060,1518175047050_F01,有人看好精星(8183)這支股票嗎?,"從PCB轉型到車用電子,看似前景光明,但自從25塊買進後,股價總是不停的跌,剛好這禮拜又碰到美股大跌,完全不勘一擊...<BR>有人看好這支嗎?",5
17145,1518506968763_F01,3374,入手一張精材 人生才會精彩XD<BR>上禮拜美股崩 公司法說會 慘<BR>股價跌了快30%<BR>但題材還在 有個富爸爸 體質有機會轉好<BR>昨天融資融券大減<BR>請問大家怎麼看這支特別的飆股?,5
17436,1519894590361_F01,6203 海韻電 股市新手請益,看基本線型感覺是呈現多頭排列，但今早買在<BR><BR>43.9以為會像前幾天一樣直衝漲停.....沒想到卻<BR><BR>開始跌，尾盤甚至跌到變成綠的，看了真的臉<BR><BR>都綠了 有大大能開示下這支還有<BR><BR>機會漲嗎？ 能順便推薦幾本書給小弟看看嗎？<BR><BR>最近買什麼都賠可見有很大的問題??,5
17478,1519996056067_F01,美桀5255分析文,這支在群組裡當天就有告知大家了<BR>現在來這邊分享給其他人<BR><BR>會買美桀的原因<BR>基本面：低於個人選股邏輯目標價20%以上<BR>技術面 ：形成W底 中間那邊有帶量確沒上去<BR>只要後面在爆大量挑戰這點位 上去機率就很高<BR>所以個人成本價是在53.2這裡<BR>另外有跟上目前主流題材 炒作機率高<BR> 以目前盤勢情況先看61 66這兩點位,5
17588,1520392170211_F01,3006 晶豪科 請益,有前輩能指點迷津一下這支股票嗎？最近Dram<BR><BR>應該還在漲價供不應求昨天看到外資 投信 自營<BR><BR>商都有買進動作 結果漲停一根，今日盤中買在<BR><BR>47.6....以為它會一路漲上去 結果怎每次我一買<BR><BR>股價都會開始跌看技術線圖股價<BR><BR>也站上了季線以為會平順點...怎覺得就這樣熄火<BR><BR>了，是我耐心不夠嗎？ 還是選股邏輯不對？有<BR><BR>大大能分享一下你們都怎麼選股的嗎？感謝,5
17597,1520412410803_F01,2439美律2018走勢,"這支走勢如同大立光一樣處於超級弱勢,別人恐懼我貪婪,是否該趁Q1布局一下等待美好的H2?",5
17656,1520618702540_F01,8046 南電 本週狂飆有人在看嗎?,台塑旗下的南電<BR>低迷好久了<BR>這禮拜漲了好大一段，周線放量放得非常強勢<BR><BR>價量上看起來有突破的味道<BR>但2月營收不怎麼樣<BR>有人在觀察這支嗎?最近有利多?<BR>不然為什麼營收平平漲成這樣<BR>不知道各位01股神建不建議下周入場小跟幾張試試看?,5
17726,1520921362997_F01,常常鬼打牆的神奇 2376 ？！,這檔很有意思 我靠這支來回賺很多次了<BR>他都有一個尿性 跌到65元就會停住 然後衝到74左右 停住 又下跌 <BR>都在這區間循環<BR>明天是否會有一樣的劇情呢??????<BR>剛剛已買入5張 66元,5
17828,1521171171942_F01,大家對大榮2608的看法,"各位股市先進<BR>本人從事買賣業<BR>常常到大榮貨運寄送貨品<BR>自從12月底聽聞大榮運費大漲價後<BR>就覺得這樣股票也會漲吧<BR>所以也關心起這支股票了<BR>也發現從12月左右<BR>外資一路不停地買(更精確地說是某一家卷商不停地買進,但其實量也不多)<BR>大家對這樣子的股票有什麼看法呢?<BR>我雖然股齡蠻長的,但因為沒什麼耐性<BR>所以並不常玩股票<BR>想了解大家的操作方式<BR>來增加自己的判斷能力",5
17890,1521424373197_F01,請問申豐這樣子的交易是代表什麼意思呢？,各位版友大家好：<BR>自從小弟去年抽到這支股票後，就住套房到現在了，就在剛剛看到申豐有交易了931張的漲停後就恢復正常了，<BR>感謝大家,5
17896,1521429852205_F01,請教2313華通這支,各位大大，請問這支股票，會持續在跌嗎? 越來越糟糕，營收獲利都不錯，為何一直跌呢? 會不會跌到20塊，那還能入場嗎? 謝謝,5
17944,1521549160809_F01,3536 誠創 真的有那麼糟嗎？,這支股票實在是太不爭氣，大家覺得這個股票，再繼續抱下去，有機會嗎？,5
17967,1521630552343_F01,中美晶 5483 這支還有機會往上嗎,中美晶 5483 這支還有機會嗎<BR>投信19號買四千多張，但接下來二天大戶都小賣，該不會是炒新聞而漲的股票吧?,5
17985,1521683695179_F01,請問致伸4915有甚麼利空消息嗎,"各位前輩好<BR>想請問致伸這支股票已經一路從92.9一路下跌到64多<BR>前陣子有看過有人說""可能沒吃到蘋果的單""的利空消息<BR>但以為在68左右會有支撐(上週還有回到73左右)<BR>結果這一週一路下探甚至破了65,像今天大盤開高但這支仍是走低<BR>請教各位先進對這支股票的看法~~",5
18049,1521809300995_F01,來預測撼訊是否會衝上500？何時？,相信大家都見識到了撼訊這支妖股的魔力了。<BR>這幾天有進場的不論是低買還是高買，通通都有賺到吧。<BR>小弟在此預測大概4月中旬有機會衝上500,5
18054,1521820424573_F01,達方8163，該逢低再買進嗎,"最近一直在觀察 達方這支,股利2塊配得也不錯，請問各位大大 這支值得逢低持續投資嗎？<BR><BR>",5
18159,1522132810155_F01,請益 3694海華,想借問各位大神們 這支股票還有機會噴嗎？ 技<BR><BR>術線看起來還是多頭，且基本面營收部分也呈<BR><BR>現成長趨勢，但今天追高在24.24塊....之後感覺<BR><BR>有些人獲利了結，股價開始往下掉，但是尾盤<BR><BR>又有拉回的趨勢，是不是主力在作洗盤，明天<BR><BR>是該開高逃命？還是有機會放著等主力在繼續<BR><BR>拉抬往上噴？ 以上謝謝～！,5
18193,1522215901851_F01,6230 超眾,"話說這支股票每天成交量那麼低, 要空的話應該很簡單吧!<BR>不知道有沒有人要空這一支. 現在大盤往下趨勢大於往上, 要空這種吧!!<BR>有人可以給一下建議嗎?",5
18229,1522307585887_F01,PTT股版害人的真的好多 舉例9958,本來阿<BR>1/3日買入9958 股價24塊而已<BR>追這種飆股<BR><BR>但都有一些臭酸 不會討論都在那亂生話<BR>跌了就說會馬後炮說跌到多少<BR><BR><BR>但才跌兩根跌停<BR>喊會跌到多少都沒到-.-<BR>然後又會拼命說這支爛<BR>XDDD<BR><BR><BR>然後真的在看PTT的推文<BR>就會被這些害人哥給洗掉<BR>然後又會在高檔喊說可以買嗎?<BR>讓人追高 哀~~~<BR>都創新高 <BR><BR>青雲害人哥XDD<BR>GOOGLE他ID會跳出他照片 穿白衣服的哈哈<BR>股版很多咖都會在亂推文 小心被影響到<BR>橘農四才子的話 別傻傻被拐了,5
18309,1522493806040_F01,請問[1527]鑽全未來走勢,小弟上禮拜看錢線百分百有講到這支看空股票鑽全[1527]，便開始關注他走勢，幾天前布局成本在51.2，目前借卷借出(4%)，請問這支股票有未來性嗎，或是建議多少賣出。<BR><BR>小弟操作股票大都是撿跌深股票(接刀型)，不會看財報與技術線，有賺的網家(已賣出)，還有套住的茂迪、裕隆、亞太電、同亨。<BR>,5
18389,1522742670856_F01,富邦道瓊台灣優質高股息，是否該提早卡位？,如題，請問各位前輩對這支今年上市的ETF怎麼看？<BR>感覺沒什麼人在討論，是否該先卡位呢<BR><BR>,5
18457,1523009065631_F01,8150南茂,南茂已經創下將近十年來新低<BR>連假前收盤在23.85<BR>好像處於超跌狀態<BR>外資有漸漸加碼回補的趨勢<BR>請問各位有人看好這支嗎,5
18529,1523269663970_F01,怎麼刪除下市股票?,"我以前買零股的偉盟8925 ,<BR>後來這支下市了，我該怎樣讓這支從我的集保帳戶去除掉? 看的真的很礙眼 謝謝!",5
18593,1523445854228_F01,台勝科3532 要認賠殺出嗎,本人搶短不成反套牢<BR>雖然已長遠來看可以續抱 但怕說要抱好一陣子<BR>時間也是成本 畢竟資金有限 <BR>這支目前已經跌快要兩個禮拜了 <BR>當天新聞一出利多 就跌得越慘 每天幾乎開高走低<BR>籌碼方面<BR>三大法人持股比也在減少當中<BR>技術面也早已跌破60均線<BR>如果破前低112 會非常危險<BR><BR>可是有鑑於本人之前好幾次停損都停在阿呆股<BR>很猶豫<BR>有沒有前輩可以給點方向 謝謝<BR>,5
18647,1523606614558_F01,2207和泰車,請問一下這檔<BR>業績不錯<BR>殖利率也有4以上<BR>股價最近狂跌是怎麼了<BR>看起來有點止跌有人在注意這支股票嗎,5
18676,1523703157668_F01,我也來報明牌-(6215)和椿,股價開始打底了<BR>最近30交易日跌了23.3%<BR>跌深就是最大利多<BR>想做股票的可以拼這支,5
