,id,title,content,cluster
12290,1499939857450_F01,請問有花旗卡友的人請進~~,最近接到花旗銀行電話，說部分卡友可以加入富邦人壽意外險保險，一個月繳2944，等於一天繳98元，期滿20年後可以領回79萬再加上12%現金回饋，更奇怪的是沒有書面資料，只能用電話預定，請問這划算嗎？<BR>請問有大大買這種保險嗎？,7
12310,1500022803300_F01,我有一張富邦鑫享受保單想解約？...,"98年頭腦發暈買了一張鑫享受分紅保單，保險金額73萬元，年繳61612實繳59764(折扣)現在已經是第9年度，到現在分紅18.768元，但是已經繳交537.876,(解約金420.407)讓我不滿意這報酬，我該解約將後續資金投入其他理財工具嗎 還是繼續繳到期嗎 請大家的教授困擾的我多謝。",7
12319,1500051506768_F01,保險單鑑定,"這是我人生第一次買保險很多不懂 求健檢<BR>想買保險的原因是,想給自己出事時不讓家人有負擔<BR>以下是保單項目 不知各位版上神人大大 可否給小弟一點建議<BR>",7
12430,1500462184715_F01,三商美邦與新光人壽的實支實付理賠哪個好?,"請問先進:<BR>三商美邦人壽享健康住院醫療健康保險附約(SHSR) 與 新光人壽安心住院保險附約(72D01) 若是 ""保額一樣"" 的狀態,關於""理賠""哪一家較划算?<BR>感謝.",7
12431,1500464157442_F01,請問終身醫療險跟實支實付是理賠上是差在哪邊?,"請問先進:<BR>請問終身醫療險跟實支實付是理賠上是差在哪邊?<BR>這以三商為例..<BR>三商美邦人壽享健康住院醫療健康保險附約(SHSR)<BR>實支實付型<BR>理賠項目:每日病房費用保險金、住院醫療費用保險金、手術費用保險金、住院日額保險金<BR><BR>三商美邦人壽好健康終身醫療健康保險附約(HHIR)<BR>終身醫療險<BR>住院醫療保險金、加護病房暨燒燙傷中心醫療保險金、住院手術醫療保險金、門診手術醫療保險金、重大手術暨重大疾病特別看護保險金、出院補償保險金、住院前後門診醫療保險金、急診醫療保險金、緊急醫療轉送保險金、癌症放射線治療保險金<BR><BR>2個保單,除了定期與終身不一樣外,一個花多少賠多少,一個是看手術倍數....<BR>終身醫療險好像理賠項目蠻多的..<BR>問題:<BR>1.對於沒住院的癌症化療,2種有理賠嗎?<BR>2.同樣的一次大手術,哪種賠的多?<BR>3.2種理賠的優缺點差在??<BR>先行感謝...",7
12461,1500555857467_F01,富邦意外險及醫療險請益,"因為覺得保險是趨勢，前陣子覺得要好好瞭解自己的保單<BR>因此請了朋友來幫忙做保單健檢及分享適合的保險<BR>目前自身擁有的保單如下 <BR>國華人壽（全球）<BR>１．至尊保本終身保險（已繳完）<BR>２．新防癌終身健康保險（已繳完）<BR>至於意外險的部分剛好到期，若要續約需年繳將近四千多元<BR>而一般醫療保險的部分，則是一直都沒有<BR>因此朋友推薦我將意外險的部分，改成富邦人壽的兩全其美（年繳2360元）<BR>內容部分似乎跟原本四千多元的差不到哪去...<BR>一般醫療險的部分是有一個新平準終身壽險(含醫療險),然後有兩個方案B跟C<BR>B+2360意外險的話，年繳為9962元,C+2360意外險的話,年繳為11520元<BR>因為兩個年費我都可以接受,因此我個人比較傾向C方案<BR>B方案每次住院醫療費用總限額為225252,C方案則為300306<BR>覺得差將近八萬挺多的~~~~<BR>不知這樣的規劃是否完整?<BR>補充說明<BR>富邦商品名稱為<BR>1.新平準終身保險 代號:XWS1 20年 保額10萬 年繳3010元<BR>2.新住院醫療定期健康保險附約 代號HSC5 75歲滿期 1單位 年繳6150元",7
12482,1500615208541_F01,主訴病情內容~拒賠!,遇到保險拒賠案件<BR>有以醫院病歷紀載<BR>被保險人主訴內容<BR>作為既往症之依據<BR>影響保戶權益情事<BR>被保險人未來看診<BR>主訴身體症狀表徵<BR>須注意投保之日期,7
12504,1500724055347_F01,保險規劃(實支實付、日額型),大家好：<BR>長那麼大第一次為想為自己買份保險，本人為31歲女性<BR>但實在是看不懂，不是怕買保險要花錢，而是怕買了卻無所用處..<BR><BR><BR><BR>1.想買保險是因為前幾個月家父因故住進加護病房一個月，出院時因有健保給付+重大傷病卡，故才花了4000多元的住<BR> 院費用，但此時發現除了健保以外的花費，其實更嚇人的是自費部分，抽痰機過了健保給付次數，使用一次約200元，買特殊灌食營養<BR> 品費用約3000多，喝完再買，零零總總住院一個月雜費部分更嚇人(約花了好幾萬吧~)<BR> 感覺以前的保險好像理賠比較多，家父住了30天(日額型，以前一年保費1萬多)，一天理賠6000，出院療養金理賠15天，一天3000，<BR> 聽媽媽說好像理賠了20幾萬~~<BR>2.以目前通貨膨脹的社會來說，是否買實支實付會比較保險，感覺一天日額好像不夠，如果又遇上需要自費的藥物的話，根本沒辦法負<BR> 擔的起只能等死<BR><BR>想請教懂保險的各位是否可簽約呢？<BR>聽了很多實在很怕買錯......<BR>謝謝<BR>,7
12525,1500828532834_F01,請協助檢視南山保單(27歲男),"大家好~~~弟弟的朋友是南山業務，多年來一直拜託弟弟捧場，所以有一些人情壓力，爬文之後發現規劃的內容有幾個保險版普遍不推薦的保單，因此想請專業的大大們協助檢視，謝謝大家<BR>弟弟的職業是油漆師傅(月收入不固定，約3萬至4.5萬)，27歲，無體況(家族有高血壓史、曾抽菸約8年，現已戒菸)，現有的保單是法巴重疾100萬(真的僅此1張)，保險需求是醫療險、意外險和失能險，希望年繳保費能控制在2萬以內。<BR>以下是他的南山朋友幫他規劃的保單內容：<BR>1.南山福愛小額終身壽險(20MPL) 保額30萬 保費6990元<BR>2.南山新康順終身保險(20NNPL)保額3萬 保費975元<BR>3.南山新意外骨折及特定手術傷害保險附約(NPBBR) 保額20萬 保費720元<BR>4.南山住院費用給付保險附約(HIR) 保額500元 保費885元<BR>5.南山人壽新人身意外傷害保險附約(PAR)保額150萬 保費2190元<BR>6.南山新傷害醫療保險金附加條款(AMN)保額3萬 保費1011元<BR>7.南山好醫靠住院醫療健康保險附約-甲型(NHS) 保費3500元<BR>8.南山重大疾病終身健康保險附約(乙型)(ZDDR)保額20萬 保費4400元<BR>9.南山住院費用給付保險附約居家療養附加條款(HR)保額500元 保費855元<BR>10.南山真獻情2手術醫療定期健康保險附約(TSIR2)1單位 保費3865元<BR>11.南山不分紅定期壽險附約(N20TR)保額30萬 保費690元<BR>------------------------------------------------------總計年繳26,081元<BR>雖然有人情壓力，我們還是希望錢能花在刀口上！<BR>初步看完規劃後，有以下的疑問(疑慮)：<BR>1.新意外骨折及特定手術傷害保險附約(NPBBR)和住院費用給付保險附約(HIR)：評價不太好。<BR>2.重大疾病終身健康保險附約(乙型)(ZDDR)：既是終身險，保額又只有20萬，似乎起不了作用。<BR>3.福愛小額終身壽險(20MPL)：是否可以減額繳清？這個主約似乎CP值不高。<BR>4.在預算有限的情況下，已經買了法巴，是否可以暫不買其他的重疾險？<BR>5.雖然這份規劃看起來每張保費都算低，但保障似乎也沒有太高，我們擔心花了錢卻沒有買到足夠的保障。<BR>請問如果要重新調整目前的規劃，哪一個部份是可以刪除的？哪一個部份是需要提高保額的？謝謝<BR><BR>",7
12541,1500887289368_F01,保險受益人？,請教...<BR>在保險的受益人，一般是填法定繼承人，不過當想將較多部份留給需要的家人，天有不測風雲，是否可以指定如下：（有配偶+2個兒子）<BR>配偶50%、小兒子50%、法定繼承人<BR>假如未來配偶跟小兒子先有狀況又忘了更改保單受益人，也不會變遺產，那麼以上是否是最好的調整呢？或要如何調整？<BR>謝謝.,7
12568,1501006815148_F01,富邦人壽金好鑽利率變動型增額還本終身保險,最近專員跟我推這項<BR>富邦人壽金好鑽利率變動型增額還本終身保險<BR>本人對這些都沒有研究<BR>但專員講的讓我好心動<BR>這個好嗎？<BR>推薦嗎？,7
12631,1501248049824_F01,尋找 桃園 保經,我想幫我小朋友保以下 罐頭保單<BR>希望有熱心的保經 可以承攬<BR>謝謝你<BR>---------------------------------<BR>全球<BR>LDC1W<BR>XHR計畫五<BR>XAR200W<BR>XMR3W<BR>XAH1000<BR>新安東京<BR>真心安癌計畫C<BR>友邦<BR>ICAN250W<BR>DIYR3W<BR>YRDR200W<BR>富邦<BR>新十全兒童計畫B<BR>---------------------------------<BR>回文或站內信 請附加<BR>服務區域 和 服務單位<BR>謝謝,7
12684,1501516159502_F01,27歲 男性 現有保單健檢及後續規劃,"一、性別：男<BR>二、年齡：27<BR>三、職業/工作內容：外勤人員<BR>四、保障需求：意外、重大疾病、醫療<BR>五、保費預算：１萬內/年<BR>六、健康告知：<BR> (1) 最近２個月內是否曾因受傷或生病接受醫師治療、診療或用藥？無<BR> (2) 過去２年內是否曾因接受健康檢查有異常情形而被建議接受其他檢查或治療？無<BR> (3) 過去５年內是否曾因受傷或生病住院治療７日以上？無<BR> (4) 是否已確知懷孕？如是，已經幾週？（女性回答）<BR> (5) 過去５年內是否曾因患有下列疾病而接受醫師治療、診療或用藥？無<BR> (心血管疾病/腦血管疾病/肺部疾病/肝臟疾病/腎臟疾病/甲狀腺疾病/精神疾病)<BR> (6) 過去１年內是否曾因患有下列疾病，而接受醫師治療、診療或用藥？無<BR> (胃部疾病/肝臟疾病/呼吸器官疾病/眼疾/婦女病)<BR> (7) 目前身體機能是否有失明、聾啞及言語、咀嚼、四肢機能障害？無<BR> (8)（成人）BMI 是否不在下列範圍：BMI＝16.5～28<BR> （兒童）生長曲線百分位 是否不在下列範圍：3%以上 <BR>七、常用交通工具：汽、機車<BR>八、預計規劃：意外.醫療(癌症、重大疾病、醫療)<BR>九、現有保險：<BR>保險公司：國華人壽<BR>購買時間：民國86年7月19日<BR>商品名稱 [英文代號] 保額/計畫 期間 保費<BR>_____________________________________________________________________________<BR>主約 至尊保本終身保險 200萬 20年期 6500元<BR>附約 附加平安保險 PA 100萬 1200元<BR>附約 意外傷害醫療保險金 8萬 1112元<BR>附約 安心住院醫療日額給付附約 NHI 計畫-10 2080元<BR><BR>主約 新防癌終身健康保險 2單位 20年期 1236 <BR>以上是目前身上所有的保險，目前自己知道至尊保本及新防癌終身健康已繳滿<BR>剩下就是意外險的部分看要不要繼續繳及尋找適合的醫療險，目前是得知．．<BR>早期的保險會理賠健保給付的部分，因此應該是繼續繳納，醫療險的部分則是有看到<BR>版上很推薦全球XHR及台灣HNRB，但爬文後還是沒有很了解兩者差異性<BR><BR>十、預增保險：同上述內容<BR>若還有預算，也可在多推薦其餘類型保險，例如殘廢、常照感覺也很趨勢．．．<BR>最近才開始了解自己身上的保險，深深覺得這是一門大學問，先跟各位業務員說聲<BR>你們辛苦了～～～但也請你們時時刻刻保持""善良服務""的初衷<BR>因為最近身邊很多朋友也在了解自己保單,很多發現內容規劃的非常離譜...",7
12695,1501571105619_F01,保險公司片面更改保單利率合理合法嗎?,剛剛朋友跟我說他投保的保險公司片面調降他的保單利率，害他20年來的投資損失慘重，真是沒有天良。<BR>我也投保了這家保險公司，合約也快要期滿了，不知道哪天會砍到我的保單，還好我的保單利率不高，就算對半砍損失也不大，可是就是不爽。,7
12738,1501719663295_F01,請教保險問題,目前家母58歲，無保險，很少看醫生，家族有糖尿病史跟痛風，有吸菸習慣。<BR>保險需求希望1.可以有身故理賠<BR> 2.有醫療保障（住院跟手術雜支費用那些）<BR> 3.有可能住院會請看護照料需求<BR>要保證每年可續保<BR>年繳預算18000~20000，可以幫我規劃跟推薦保險商品嗎?,7
12793,1501854699696_F01,31歲 保單請教,請教神人們 我現在31快32了 想說買個保險<BR>只要最基本的就好 想問 這份保單 適合現在年紀的我嗎？<BR>不是很懂保險 請教大家 謝謝 這樣買是 正確的嗎<BR>個位大大 小弟31,7
12821,1502012891930_F01,請問保殘廢殘扶險簽約時，投保紀錄勾錯會不會怎樣?,"<BR>如上圖所示<BR>老婆笨笨的<BR>她不知道自己有保 實支實付傷害醫療保險 跟 實支實付傷害醫療保險<BR>卻還在投保紀錄那邊 ""勾 否""<BR><BR>想請問這邊的保險達人<BR>這樣會有什麼影響嗎?<BR><BR>或是這情況要問業務員還是客服專線呢?<BR>謝謝",7
12876,1502238932156_F01,"安聯薪欣向榮變額萬能壽險A,是否該退？",請各位大大幫忙提供意見喔^_^<BR>以下是老公在100年所買的安聯薪欣向榮變額萬能壽險A，<BR>當初是因為每月薪水有超過每年繳稅的%門檻，所以想從公司薪資直接扣除已降低年總收入（老公不懂保險，認為這個是儲蓄險?是嗎？我覺得不太像！）<BR>目前已繳6年了，因為之前礙於個人隱私我也沒有過問這張保單。<BR>最近因為想幫老公（45歲）買基本保障的醫療險才發現這張保單真的很奇怪，不知道可以保障什麼？<BR><BR>20年期，<BR>月繳6000，<BR>主約保額240萬<BR>另外投資：巴西（二） 2094<BR> 全球銅鐵產業（二）2095<BR>附約：新安逸豁免保費帳戶型<BR>管理費100/月，危險保險費100/月<BR><BR>想請問這張保單現在如果解約的話，應該會虧是一定的，但是有好的建議可以提供給我嗎？<BR><BR>PS：另外我比較偏好定期的險種，可以請厲害的大大提供我老公（45歲）的基本保單嗎？<BR>目前先生除了這張沒有其他任何保單，<BR>我想先幫他買意外險（華南富貴寶2+E方案 ok嗎？），壽險（看這張安聯的如何解決），定期醫療（全球XHR ok 嗎？）重大疾病或重大傷病或癌症買哪一個？經費有限，買基本保障就好。,7
12877,1502243395054_F01,請達人幫忙評估保單,"請問各位達人，<BR>在經費有限的情況下2萬左右/年可以買到該有的保障嗎？（32歲/女）<BR><BR>目前規劃如下，有需要調整增加或刪除掉嗎？<BR><BR>意外險：富貴寶2+B方案 2403元（目前為家庭主婦）<BR><BR>醫療實支：[全球]XHR/計畫五<BR> 主約終身壽險QWX,15年期/21萬，第一年繳7245元（想要用隔年減額繳清主約）<BR>全球只能搭這個主約才能減額繳清主約嗎？<BR><BR>[遠雄〕主約FX7(隔年減額繳清，20年期/10萬，繳費3800元）、定期重疾RG1（100萬）,定期癌症XCD（3個單位）<BR><BR>〔友邦〕JTL壽險 10年期/100萬<BR> YRDR殘照 一年期/300萬<BR> DIYR有備無患 一年期/3萬<BR> JDDR重大疾病 一年期/200萬（這個需要嗎？前面有RG1了）<BR><BR>〔新安東京〕真安心計畫C<BR><BR>PS:另外想請教已經買產險意外險了，還需要買壽險的嗎？",7
12904,1502293953895_F01,[問題] 有關投資型保單的剩餘價值,小弟有一檔投資型的保單「國泰人壽創世紀變額萬能壽險丙型」，已經放了超過10年：<BR>總繳保險費42萬<BR>保險公司累積收取費用=44502元<BR>累積保費費用=90000元<BR>5年前因手邊需要一筆資金運用，保戶累積提領了約25萬元<BR>日前被保險營業員告知保單帳戶價值餘額=0，要我再補1萬元保留保障，我算了一下每年保單帳戶會被收取約3600的管理費用，保單的價值是200萬的壽險。我目前的狀況是37歲，未婚，沒有小孩，也沒有立即的經濟壓力...<BR>我想問問各位朋友，這份保單還值得繼續保留價值嗎?<BR>想聽聽版友們的看法，謝謝!,7
12925,1502351480283_F01,有人對儲蓄險有研究嗎?可以幫忙解惑?,"六年前跟朋友買了下面這張<BR>""南山人壽鑫美年發外幣增額還本終身保""<BR>朋友說這張每年都會給你還本金,且從第一年就會給,放久很賺<BR>我當初想說目的是強迫儲蓄而已,就買了<BR>我是用季繳,每一季繳547.82美元<BR>六年下來總共繳了13147.68美元<BR>結果今天約朋友出來談解約的事<BR>他說解約只能拿回105XX美元<BR>我有點嚇到,中間2600美元不見了<BR>問他為什麼<BR>他說前幾年的還本,不是白白給你的,要先從裡面扣掉<BR>前六年還本金總共是1260<BR>我說就算扣掉還本金,那也還有1400美元不見了阿<BR>他說那應該是季繳額外扣掉的錢<BR>然後基本上這張保單至少要第七年的還本領完才不會虧(而且前提是要用年繳的方式)<BR>=========================================================================<BR>我算一下,用季繳的我<BR>至少要放到第十年,我投進去的錢才會打平<BR>真的是這樣?<BR>儲蓄險爛到這種程度?<BR>本來六年就想解約,自己拿去做額外投資<BR>現在完全打亂了我的投資計畫<BR>而且我還有買另一張儲蓄險.....<BR>不知道又被扣了多少錢<BR>這樣還真不如當初自己存就好了....",7
12937,1502410975080_F01,"保險合約用平板簽名,有風險嗎?","如題<BR>最近老婆幫我規劃了一些醫療險,意外險...<BR>結果聽說要當事人在平板手寫當簽名<BR>我第一次聽到這種作法<BR>但問投保多年的同事,都是用此法簽名<BR>請問各位也都這樣作嗎?<BR>我的觀念是電腦可以截圖複製,覺得不太安全<BR>總覺得白紙黑字比較實在<BR>想如果一定要在平板上手寫簽名<BR>想在簽名旁加註""保險用""<BR>有必要這樣嗎?<BR>謝謝",7
12974,1502587265365_F01,請問醫療險問題與選擇,在下家人有人因癌症而亡，有人受糖尿病所苦，花費不少。<BR>最近看到親戚因為患罕見疾病住院治療，耗資龐大，所以有保醫療險的想法。<BR>在下目前身體情況半年前檢查皆良好，唯有高度近視問題，醫師有提醒需多注意眼睛保健，以預防視網膜剝離。<BR><BR>在下有幾個問題想請教：<BR>雖然我目前狀況良好，但家族或親戚因疾病過世者不少，若防患未然，是否終身醫療險較適合？<BR>再者，若投保後，萬一有天視網膜剝離入院開刀，投保前已告知為高度近視患者，業者會拒賠嗎？<BR>目前想到這些問題，如果有推薦的保險公司或保險需特別注意的地方，還麻煩各位分享，謝謝！,7
12986,1502636874331_F01,請問小孩快滿2個月該買那種保險？,請問各位如果幫女兒買醫療險!要買那一種呢?一年費用大約多少呢？<BR>防癌險需要現在買嗎,7
13007,1502690966580_F01,(請教)醫療險&意外險的差異與問題,先跟各位01版友大家問好<BR>大家好!<BR>最近小弟出了小車禍想請問一些問題，若有經驗或懂的人麻煩給與回答<BR>自己有保台灣人壽健康龍終身醫療險9年前保的一年保費1萬多元<BR>意外險是而外保產物保險一年兩千多元<BR>兩者都以申請保險理賠也都下來了，但繳的多的醫療險只理賠了8千元左右<BR>繳少的意外險賠了7萬元左右，想請問那是否就不需要保醫療險了，把意外險的金額增加<BR>或者是在保第二份意外險是否比較好。感覺醫療險繳的多都當冤大頭<BR>車禍是骨折有開刀花了六萬-七萬元左右。,7
13068,1502908452851_F01,急！富邦人壽富利高升終身壽險，有關保險問題！,請問一下富邦人壽富利高升終身壽險！20年保險金額28萬！年繳3萬六多！今年已繳了六年了想說第七年繳完後要領出來當購車基金！可是我今天拿出來我看到年度解約金整個傻掉六年繳21萬多 年度未違約金15萬多！是不是虧了六萬多<BR><BR>因為當初是朋友介紹的業務我記得是說七年後拿回來不會扣到本金！不知道我看得對不對<BR>希望我看錯！欲哭無淚爬了聞好像是這樣！我太天真了，當初根本都不知到太相信人了，<BR>如果真的是怎樣我改怎麼處理比較好虧少一點麻煩懂的幫幫我！,7
13104,1503032241171_F01,保險問題及人性...[已解決],"日前發文請益關於南山保險的內容.<BR>謝謝版上先進熱心及南山客服的回覆.<BR>不少朋友關心,也想詳細瞭解實際狀況,也避免遇到類似的業務手段,謝謝朋友分享.<BR>[過程刪文.......]<BR><BR>如果是好的內容,規劃又能符合需求,且真的是保障,又在能力內的保費,這才是好業務,這時的人情更有價值.<BR>經評估大家的建議後,最後決定以解約處理,趁損失最少的時候....",7
13134,1503247056944_F01,關於 新光人壽新健康百分百終身險,"在三年前 幫兩個兒子保了 新健康百分百終身險 這種保險 保單上面是這樣寫的.. 因為當初我媽她跟那位保險員比較熟 而我兩個兒子當時也都沒保險 我又收入不多 保險員建議我媽 可以叫我幫兒子保這種險 年繳2人大約37000多 我個人對保險這種東西是完全不懂 所以當時都交給我媽去用 我負責付錢就是了@@"" 但前些日子老媽子不在了...這幾天收到保險要繳費的單子 想了解一下 這種保險是在保些什麼東西...有幾個問題 想請教一下 對這方面了解的大哥 大姐們<BR>1.這種保險 是什麼狀況下才有理賠<BR>2.這種保險是要繳幾年<BR>3.什麼是終身險 是說..例如 這保險要繳10年 10年到期了 不需在繳保費 但這張保單還有效嗎??<BR>4.假如 這保險是要繳10年保費 10年到期了 那保費拿得回來嗎?? <BR>因為印象中 以前有聽老媽說過 他以前保險到期繳完了 可以拿回多少錢 還可以每年領多少錢 領到人走為止",7
13145,1503297465105_F01,小弟最近想買保險 國泰 請益,國泰 27男 已婚 一子 職業：代理教師<BR><BR>主約一：真安順手術醫療終身保險 1000元 7850<BR>新真全意m-10. 2436<BR>真關懷豁免 497<BR>真康愛防癌終身 一單位 5564<BR>真全方位傷害保險 2690<BR><BR>二、國泰鐘幸福特定傷病終身 30萬 8730<BR>請問一下大大，此單感覺保費很高保障很低 該如何修改或建議 感恩。<BR><BR>,7
13148,1503314243742_F01,如何有效率買保險?,"不好意思有幾個問題希望有經驗的大大可以討論~<BR>觀念錯誤也歡迎糾正<BR>1. 公司的選擇 <BR>我因該會選擇 (申訴率(每百萬件)) 比較低的?<BR>國泰? 南山?<BR>2. 終身壽險 vs 定期壽險<BR>定期比較便宜也彈性?<BR>3. 醫療險<BR>買終生, 實支實付 比 住院的好<BR>4. 網路買<BR>保險可以透過網路買嗎? 我是覺得可不可以跟車一樣, 不要透過業務比較便宜<BR>反正很多業務離職就變成保險孤兒?<BR>5.每年投保金額加起來的金額不要超過年收入的10%?<BR>小弟有家庭, 有一個幾個月的小孩, 人生第一次買保險.",7
13151,1503333478324_F01,請各位前輩幫忙健檢這份保單,"各位大大好<BR>此保單是我朋友的<BR>不知能否麻煩各位前輩健檢看看<BR>依我朋友形容,說這份保單五~六年後解約就能拿回本錢跟些微利息<BR>可是我去查了!!!美滿富足六年期最少也要第六年約滿才能開始有獲利!!<BR>20年期的怎麼可能提前解約又不損失<BR>請問我朋友是不是被當羊宰了呢?<BR>要是確實被宰了,該怎麼樣做才能損失最少<BR>還有他這張保單有啥保障呢?<BR>在此代朋友謝謝各位 <BR>性別:女 年齡:26歲 職業:資訊業",7
13239,1503650218389_F01,未來理財規劃，懇請前輩提供建議,小弟目前為職業軍官28歲，月薪實領五萬餘元，扣除孝親費，可運用金額約四萬五，待停年到，升校官沒有問題，查了一下退伍金，目前累積金額為180萬餘元，（預校6年+官校4年）。<BR>無房，無車，無負債，信用卡乙張，繳款正常無分期，信用比分數為796分。<BR>目前有張富邦儲蓄險年繳十萬餘元，已繳三期 ，尚餘三期<BR>保險部分，雙意外險，雙實支實付醫療（含特傷副約），殘扶險（定額醫療，重傷），癌症險，部分便宜主約忘記是什麼，年繳保費約五萬三。<BR>股票踏入兩年，持有中信金五張（均價15.88），漢翔五張（均價37.88）。<BR>鑒於軍公教前輩的抗爭，不論未來軍人退休制度如何調整，希望自己在年輕時儲備未來穩定的老年生活，懇請各位大大寶貴意見，如何用年輕的金流打造未來自己生活堅實後盾？<BR>ps:目前沒有退伍規劃，會持續走下去，讓終身俸變成被動收入一部分,7
