,id,title,content,cluster
14254,1507610045523_F01,茫茫然的看法..,股市萬點很久了<BR>1.我持有台股反向ETF也很久了<BR>還好<BR>我對行情承認不懂<BR>所以持有很少總計虧損幾千元台幣<BR>(真的是休閒來的..平常也很少注意這事)<BR>2.歐元有賺到接近10%<BR>不過這是不小心買的<BR>原本要買來去德國用的<BR>已經換回台幣<BR>3.全世界的股市好像都有債券化的樣子<BR>這狀況可能跟中國大陸崛起有關<BR>因為它是一個很穩定成長的勢力<BR>4.台股漲可是台灣房市不好..有矛盾<BR>.............................<BR>結論<BR>因為中國崛起<BR>所以世界跟以前不一樣了<BR>這樣說對??<BR>..........................<BR>接下來<BR>想買日幣<BR>做反向日股ETF<BR>原因自己也說不清楚<BR>大概是<BR>感覺日幣對台幣便宜了<BR>然後日股很高點了<BR>日幣升日股會跌<BR>這樣<BR>有道理??<BR>,2
14278,1507702220975_F01,為什麼都沒人討論 台積電 呢?,投資與裡財 這一版 為什麼 都沒有人 討論 台積電呢? Thanks.,2
14294,1507777658975_F01,250 小摩調升台積評級至「買進」,2017-10-12 01:54經濟日報 記者王淑以／台北報導<BR><BR>台積電董事長張忠謀宣布退休並安排雙首長制接棒後，外資給予高度肯定，繼摩根士丹利、瑞銀、花旗環球、里昂、德意志證券等看多台積電後市，摩根大通（JPMorgan）昨（11）日也發布台積電最新報告，將台積電評級由「中性」上調至「買進」，目標價調升至250元。<BR>張忠謀選擇在台積電營運高峰期間宣布退休，是正確決定且具有高度智慧，一名外資分析師私下透露，由於台積電技術具有幾乎寡占地位，因此沒有張忠謀的台積電也能穩健成長。<BR>目前外資券商給予台積電最高目標價的是里昂證券半導體產業分析師侯明孝的300元。鑑於外資一致看好台積電未來展望，台積電股價再創新高機會十分濃厚。<BR>摩根大通把台積電的評級由「中性」上調至「買進」，目標價調升至250元。摩根大通認為，台積電在明年下半年7奈米市占擴大、AI從2019年貢獻獲利及半導體第4季末補庫存，同時預估台積電2019年仍將拿下iPhone全部的應用處理器訂單，並搶回高通（QUALCOMM）7奈米行動晶片訂單，基於上述理由，摩根大通調高台積電明年及後年每股盈餘，幅度3%及4%。<BR><BR>大魔也喊買~~~~~讚喔<BR>,2
14295,1507778694682_F01,迎接台股最輝煌的一年,哥決定今天火力全開，<BR>大舉錢進台股<BR><BR>雙十國慶後台股再次強彈，<BR>這波將會是台股創造新高峰的前兆，<BR>空軍恐全面緊繃<BR>2018年，<BR>台股真正的輝煌年代，<BR>即將到來,2
14300,1507794665523_F01,明日黑色星期五,"台股歷史有多次黑色星期五跳水記錄。<BR>雖然歷史不會重演,但可以參考。<BR>Google一下<BR>當然最好別發生。<BR>今天還是把手上的多單了結掉觀望一下。",2
14319,1507871400139_F01,感覺台股要衝破11000才會收手 因為。,周遭友人。。。都嘛忍不住。。。紛紛跳下去 台股。。只因為天天噴。。。受不了 也為了力挺台股 所以買了 反正你老師看空 剛好保護買多的 所以 衝 衝 衝 拉回就是買點 熟悉的一句話 大家認同嗎？,2
14322,1507873911790_F01,發起全台 賣台積電股票活動,讓圖說話 台積電月k圖 想空台積電 至少準備40萬 跟他打一場<BR>一季左右的頭部 因為這個竭盡噴出 從214到現在237<BR>大家不用空幾張 一人一張 空個三年 台積電要殺回120<BR>為何??很簡單 日後才有長多局可玩<BR>貼圖最準 十年難得一見的機會 想空台積電的人 下週一是出手好點<BR>台積電是整個多方主帥 我會發起投資人賣台積電 就圖說話 讓主力套個爽 <BR>有錢最大 那是錯誤的 玩死你最大,2
14331,1507896276412_F01,楊世光在節目中說的會是真的嗎？,預言台股下個禮拜會崩盤，剩下一個禮拜逃命的時間，這......該相信嗎？,2
14338,1507910727645_F01,台股何時會大崩盤,"我個人的建解是<BR>明年六月或是Ｑ４<BR>可能會出現財富重分配的機會<BR>２０１７年相對的會是平穩的<BR>也就是多頭市場<BR>升息效應，也不會馬上反應在市場上，相反的還會更加狂熱！<BR>在大家都覺得現在是萬點股市了，成天在害怕會不會大崩<BR>我看了也覺得好笑，來看看下面這張<BR><BR><BR>這才是目前台股的真正加權指數<BR>不要成天以為自己在萬點的股市裡好嗎<BR>有人會問你這張圖是那來的，我說你把台積電加權從指數中拿掉吧～<BR>你會發現這才是真正的台股，也說了明明台股小漲啊，為什麼自己的持股好像大跌百點一樣<BR>我說啊，台股還會在拉二千點！ 也就是一萬三點左右～<BR>目前～外資也在慢慢收資金，但要怎麼收，你才不會發現呢？<BR>很簡單就是調節～前陣子的大跌就是資金要調整<BR>回收部份資金和利潤後,開始拉,怎麼拉?<BR>當然是全力拉一支台積電,台灣最大的權值股<BR>來造成股市萬點的假像,實際上也不過是去年八千多點而己<BR>當權值股拉上來造成假像後<BR>開始就中小型類股佈局,你最近就會開始看到了,會有不少隻平時沒名氣的都開始拉,狂拉<BR>然後大盤指數,開始連動往１１０００~在來１２０００前進<BR>散戶一開始會傻掉，以為要大崩了，沒人敢出手<BR>但是到了１２０００，我保證那時人人都變股神<BR>市場開始狂熱！直到熱錢資金回流<BR>那時就是真實的大崩崩了<BR>大崩崩前也是有些訊號會出來的<BR>大家在２０１７年可以安心，別聽名嘴在那屁～<BR>為什麼叫名嘴呢，就是壈消息永遠說太早～好消息永遠說太慢～<BR>以上個人發言～信的就信～不信的也把手機打開設行事歷時間定在２０１８年６開始觀查，９月要把資金拉一半下場<BR>然後等待財富重分配的時間到來吧～",2
14375,1508081752288_F01,可以問別人分享的東西 可是我看不懂的地方嗎??,阿斯匹靈<BR>我看不懂下面這段 為何說賣超八百億之後 加權破前高 但六百億沒買回來就是被尬到??<BR>----------下列敘述看不懂------------------------<BR>外資最近五天連續買超現貨約200億<BR>不過上一波外資是賣超了800億之多<BR>現在加權已經突破前高<BR>外資卻還有600億還沒買回來<BR>多單被嘎到<BR>再看看借券的部分<BR>之前借券賣出餘額增加了105萬張<BR>不過之前在低檔也只回補了24萬張<BR>還有80萬張的借券賣出<BR>也被嘎空<BR>----------上列敘述看不懂--------------<BR><BR>以及下面這一段 我也看不太懂 為什麼基金贖回會造成外吃虧錢危機 大家賺錢 外資也賺錢啊???手續費就賺多少了??<BR>-------下列敘述看不懂----------------<BR>如果到年底之前<BR>美股再繼續大漲千點<BR>台股站上一萬一千點<BR>那麼上圖的那間外資專業機構<BR>以及其它的外資機構<BR>應該會收到大量的基金贖回<BR>然後面臨大虧的危機<BR>這樣的機率是否很高？<BR>還是說<BR>我們的皮要繃緊一點<BR>多加留意風險會隨時發生呢？<BR>-------上列敘述看不懂--------------------------,2
14381,1508123201793_F01,政府做多心態沒變 大立光 台積電 鴻海 輪流拉 請勿放空指數,台積電弱 大立光強 鴻海強<BR>台積電弱 大立光弱 鴻海強<BR>台積電弱 大立光強 鴻海弱<BR>台積電強 大立光弱 鴻海弱<BR>台積電強 大立光弱 鴻海強<BR>台積電強 大立光強 鴻海弱<BR>每天會依此規則循環...指數會不斷的慢慢墊高...<BR>之前已經說過了8年國民黨拉房價 8年民進黨拉股價 不到12000不只 .....<BR>除非出現 弱弱弱 的狀態 達三天 就可以出脫了 ....<BR>不過本人我最近沒在玩期指 .... 單純看法分享 !!!!,2
14390,1508136016835_F01,【狼又來了】57楊世光得意說要送大禮，只有出清選擇，因為丁年庚月崩盤,狼又來了~<BR>我是楊世光的忠實觀眾 ？！<BR>因為他的節目言論是重要的反指標來源？！<BR>楊世光從今年初喊崩盤，台股萬點也喊崩盤，都沒崩，反而開始漲<BR>楊世光嘎久了禁聲一段時間後，就能開始出來說話，這是鐵律，<BR>別已委遲早有一天會喊對<BR>57金錢爆:丁年庚月行情轉折時？台股下周只能離場？！<BR><BR>57金錢爆楊世光得意說要送大禮，只有出清選擇，因為丁年庚月崩盤<BR><BR><BR>楊世光真慘........裝神弄鬼......<BR>今天台股大漲逾百點再創逾27年來新高<BR><BR><BR>,2
14431,1508294870037_F01,獨家！台股重挫就是買點,以哥目前最新看法，<BR>現階段台股下殺就是騙散戶出清，<BR>因為三點重要因素:<BR>1.先前台積電暴漲<BR>2.眾多個股緩跌<BR>3.台股目標11000不變<BR>近期個股若再續跌，<BR>一定一堆散戶抱不住，<BR>這時候哥早已資金準備好，<BR>準備幫各位護盤啦<BR>所以台股下跌不要慌，<BR>答案就在大盤走勢及所有個股走勢內，<BR>就看各位有沒有認真做功課了,2
14460,1508391361052_F01,台股逆轉勝將衝11000，8K說話了,"有沒有，<BR>這陣子哥一直強調，<BR>耐心真的很重要<BR><BR>近期值得關注的一件事，<BR>19大是否將影響台股未來走勢，<BR>哥已經做好覺悟了，<BR>先透漏一個""吉""字。<BR>空軍愛只注意喲~~<BR>這波漲勢，<BR>恐成為空軍史無前例的大浩劫，<BR>不要以為哥真的是反指標<BR><BR>",2
14478,1508480493505_F01,台股高峰生死鬥，怒砸重金衝一波,通通讓開，<BR>哥要率先領軍衝前線了<BR>不多說，<BR>收盤前立馬怒買！<BR><BR>不知為何，<BR>哥這週對台股有特別強烈的信心，<BR>心中不斷湧起巨浪，<BR>彷彿台股隨時一觸即發<BR>今天，<BR>是非常重要的一天，<BR>因為你只要選錯邊，<BR>下週肯定會賠的不要不要的<BR>各位，<BR>你們選對了嗎<BR>,2
14503,1508613647625_F01,股市,《鳳凰財經》繪製「地球股災系列」漫畫第一期，就以「台灣股災」作為題材，台股在1985年以636點起步，不到一年就漲到了900多點，在1986年10月正式突破1000點大關，突破1000點後，台股的瘋狂才正式開始，1986年到1987年，短短的一年內，台股翻了將近5倍，從千點漲到4673點，這幾年，台股的開戶數從5、6萬爆增到了600多萬，可以說是全民都在炒股！<BR>那個時候到底有多瘋狂？9點開盤，台灣家庭主婦一天的行程就是早上炒股，中午在高級餐廳用餐，下午逛街，晚上KTV、跳舞；在外上班的公務員也不惶多讓，都是在股市收盤後才開始辦公，1987年，時任證交所顧問的余雪明終於公開表示「台股跌是不可避免的，再漲下去就不合理了！」，後來政府把幾個主要的證券公司負責人找去喝咖啡，台股終於遇到一個重大利空，3個月內，大盤從4673點跌到2329點，整整腰折一半。<BR>1988年股市又開始狂拉，從2341點狂漲至8789點，僅短短8個月就暴漲3倍之多，但此時台股又面對一大利空，時任財政部長的郭婉容宣布開徵「證卷所得稅」，台股又從8789點一路狂跌到4873點，也幾近腰斬，股民憤怒走上街頭，終於逼迫政府取消「證卷所得稅」，1989年到1990年台股激烈反彈，大盤從4873大漲到12495，這也是台股歷史最高點，那個時候投資股票有多好賺？隨便選個股票持有一個月，平均就能賺10%，20歲都可以隨便花10幾萬去香港買名牌。<BR>但1990年之後，台幣升值速度放緩，貿易順差也不再走高，在政策面沒有重大利空之下大盤開始往下掉，從1990年2月最高點12495暴跌到1990年10月的2560點，短短10個月整整跌了近10000點，一大堆百億富翁瞬間變得負債累累，炒股的貴婦們也都只能乖乖回去上班，全部吃下去的全部都吐回去，大家才發現「股市不是提款機,2
14510,1508692746896_F01,又傳奧步？傳三星斷貨EUV機台 狙殺台積電,半導體廠搶進先進位程，紛砸大錢向獨家供應商艾司摩爾(ASML)，訂購要價1.5億美元(摺合新台幣約45億元)起跳的極紫外光微影設備(EUV)。根據韓媒報導，ASML今年規劃生產的12台EUV機台中，南韓三星擬訂下10台，外界推測三星此舉除考量ASML生產不順外，也趁機阻礙台積電等其他競爭對手的量產進度。<BR>原文網址：https://kknews.cc/digital/kaj8ezq.html<BR>https://kknews.cc/digital/kaj8ezq.html,2
14541,1508818762425_F01,台股長期被台積電綁架成為殭屍市場,"台股上萬點,全台小股民無感,大部分公司股價不及8000點,日成交量不及20年前萬點行情的一半<BR>原因就出在加權股價指數的""加權""兩字<BR>台積電的大股本,讓2330影響指數達20%<BR>看得到的""行政院開發基金""持股高達2成<BR>加上看不到的泛公銀或各個政府基金持股<BR>輕易操控台股指數,要漲要跌,隨執政黨高興<BR>顏色對了,關係夠了,光靠內線,吃三代不成問題",2
14594,1508942466572_F01,台灣生技優勢?,因為我不懂生技(生技股)<BR>可是<BR>看K線圖<BR>台股現在最有潛力的好像就是這個族群了<BR>因為跌得很深很久了<BR>請問台灣的生技產業的優勢??<BR>放在全球地位如何?<BR>會不會受到貿易協定的危脅?<BR>台股我還想買的話應該只有生技了<BR>不知道對不對?<BR>其實看NBI生技指數<BR>沒有像台灣跌那麼深啊??<BR>討論一下...?,2
14618,1509013402219_F01,為了台股上一萬一 我做這件事 有圖,各位買多的方心吧！ 只要我做空 台股就會噴 所以我犧牲了。。。。 看圖吧,2
14627,1509074634827_F01,近日台股大盤都在橫向整理,美股指數漲一天跌一天，台股開高走低，振盪收小紅或小黑橫向整理，成交量不足以上攻，自己買的股票獲利幾乎全吐回去，資縮手的嗎？,2
14644,1509124360788_F01,加泰隆尼亞宣布獨立，周一台股會怎麼走?,加泰隆尼亞宣布獨立，對台股說是好是壞?,2
14665,1509295148460_F01,這些年，我在台股永生不滅的秘密,很簡單，<BR>因為哥掌握了股市脈動，<BR>當大家看衰台股時，<BR>就是哥最安心買進的時候<BR>不多說，<BR>週末依舊果斷加碼，<BR>台股11000不是喊假的<BR><BR>接下來，<BR>要透露給各位的是，<BR>哥在台股永生不滅的五大因素，<BR>如果你也想要縱橫股海，<BR>就一定要跟上哥的腳步<BR>,2
14785,1509723567625_F01,外資落跑， 台股會崩嗎?,這幾天外資賣超居多，散戶比例上升， 各位專家覺得以下兩種外資落跑情形哪個比較可能發生， 以及各自對台股影響有多大?<BR>1.慢慢賣超淡出<BR>2.急抽資金撤退??,2
14788,1509725110987_F01,一張圖秒懂台股走勢，今天出場的人要哭了,其實很明顯地，<BR>這週台股就是在洗散戶，<BR>相信能持續抱緊的人不多，<BR>畢竟10800對各位來說是高點<BR>台股一路走來，<BR>說長不長說短不短，<BR>但才只是經歷一個人的半輩子，<BR>未來還有很多人會接觸到台股，<BR>1990~2200年都有可能，<BR>所以哥認為2017年只是台股其中一個中低點，<BR>千萬不要把圖畫的太小，<BR>咱們要向遠方看，<BR>不是每次都會出現像2008年的金融海嘯，<BR>因為能從台股最低點(3000)進場買股的機會真的非常難得，<BR>以為外資這麼輕易就讓散戶能再次遇見嗎<BR>前幾年，<BR>哥在書局看過一本書的簡介，<BR>美股30000點不是夢，<BR>當時還真的連翻都懶得翻內容，<BR>根本覺得那本書在說笑，<BR>結果現在美股竟然到23500，<BR>真的有點不可思議<BR>現在，<BR>換哥來說笑了，<BR>台股將上看11000，<BR>加上iPhoneX也開始發售了，<BR>想不漲都難,2
14800,1509769388045_F01,高處不勝寒：台股高點何在呢？？,現在各大理財網路論壇上，只要一出現空方言論，必然遭諸多網民集體訕笑嘲弄。<BR>其實就台股這卅年來的歷史而言，此乃非常標準的多頭末期現象，身邊有許多親友們甚至抱持「絕對不停損」的態度，想要長期抱股----因為這三年來，只要是長期抱股不賣出，最終就能順利解套，甚至還可獲利。<BR>然而不少個股的主力大戶可養了五至七年之久，如今大盤已到如此肥美之際，此時不殺，還待何時？等到明或後年跌破八千點時，再殺出持股嗎？？想當然爾，主力大戶與黑手們理應不會笨到如此吧！？<BR>是故外資與主力大戶只要需繼續拉台GG（股本如此龐大，竟還能屢創新高！）與大力那個光，全力穩住市場多頭的持股信心，其他中小型個股、投機股與績差股，黑手們則是趁機拼命出貨，此乃「聲東擊西」的暗渡陳倉。<BR>是故在此斗膽懇請各位老弟小妹子：務必提防此類「賺指數、賠價差」之不良伎倆，請時時檢視您手中的持股。如發現籌碼面有任何不對勁之處，建議及早處理為宜。<BR>上述純屬個人粗淺之愚見，尚請各路先進前輩們不吝賜教。,2
14801,1509781979386_F01,12682到2485,看到近期股市極為熱絡，不禁回想起一段傷心往事：<BR>記得當年有位和我交情甚篤的學長，假日也常帶著我玩重機。當年重機還未核准進口，能「偷偷」玩得起的，大都是富二代或身家不錯的官家子弟。我見學長家世僅是普通，便詢問他玩車的資金來源。學長表示：他每日投入股市投資，獲利甚為豐碩。還說股市投資是他終身的志業，並以身為專業投資人為榮。<BR>猶然記得台股狂登12682的那幾天，學長還興高采烈叫我陪他去好好慶祝，正巧那時感冒未癒，便無法前去赴宴。但過沒多久，股市突然之間反轉直下，從此便沒了學長的消息，只知他與眾人失去聯繫。<BR>後來過了許久，有次在某婚宴場合遇上同班同學，正巧聊到這位學長。同學才告知：這位學長因當年股市嚴重套牢，甚至連累家人。最終因罹患憂鬱症，自殺過數次，所幸都遭人救回，最後的消息應是已住進病院療養中。聽聞此事，令我感到不勝欷噓！！<BR>,2
14881,1510114293096_F01,懼高症...，決定減碼！,高點真的太難玩了<BR>陸股美股年漲幅快40%<BR>有可能面臨大修正<BR>台積電應該到頂了<BR>加上張忠謀退休是大利空<BR>Iphonex在中國反應不如預期跳水中<BR>減碼，再跟陳嘉偉老絲放空,2
14887,1510119780383_F01,顧立雄：台股殖利率佳 投資股市比放銀行好 鉅亨網記者陳慧菱 台北2017/11/08 12:43,台股台股新聞<BR>顧立雄：台股殖利率佳 投資股市比放銀行好<BR>鉅亨網記者陳慧菱 台北2017/11/08 12:430<BR>金管會主委顧立雄：台股殖利率佳，投資股市比放銀行好。(鉅亨網資料照)<BR>金管會主委顧立雄：台股殖利率佳，投資股市比放銀行好。(鉅亨網資料照)<BR>台股上萬點已超過 100 天，創史上最長天數紀錄，金管會主委顧立雄今 (8) 日表示，若投資人的心態健康，從台股基本面的本益比和殖利率來看，尤其台股殖利率佳，投資人從股市可以獲得的投資報酬率，會比錢放在銀行要好。<BR>立法院財委會今日繼續審查金融監理沙盒法案，顧立雄於立法院表示，與過去的萬點相比，當時「很多人很瘋，心態上不見得很健全」，而這波萬點行情從法人和散戶投資看來「是相對健康的環境」。<BR>顧立雄進一步指出，若能從台股基本面的本益比和殖利率來看，投資人從股市可以得到不錯報酬，若不要偏廢哪些股票，或透過基金分散式投資，投資報酬率應會比錢放在銀行要好。<BR>至於年輕人如何投資？顧立雄建議，年輕人因為擁有的投資金額較少，可以從定期定額出發，不管是定期定額買股或買基金，以定期定額買股來說，現在有提供最低 1000 元就可以投資的管道，就能利用少量資金投入股市，也是很好的理財方式。,2
14930,1510248375598_F01,千線萬線不如一支台積電,報給大家一支明牌，我也是看了好幾年才看破。<BR>有長輩好幾次提到，如果沒有內線，那就只買台積電<BR>今天內資股大殺，大型股獨強<BR>我突然覺得，對，沒錯，只要抱好台積電，其他功課都不用做了<BR>台灣最好的人材都在哪裡了，怎能壞到那裡去?<BR>現在認錯還來的及，大跌至10400點時 all in,2
14981,1510564451352_F01,台股大盤要開始反轉的嗎？,台股近日易跌難漲，由其是電子股漲多就拉回，感覺大盤非常弱勢，空方勢氣強盛，是否要反轉了？,2
14994,1510588830111_F01,台股出現不祥之兆了，恐下探10400,先說，<BR>今天哥完全沒被騙進場，<BR>因為很明顯就是開盤誘多<BR>收盤更是說明了一件事，<BR>台股方向已經在變了，<BR>如果你真的會技術分析，<BR>看法就會和哥一樣<BR>假設這波是玩真的，<BR>至少下探到10400，<BR>今天有買進的人都要哭了<BR>,2
14996,1510593669534_F01,台積電連兩季獲利年衰退？,不知道台積電Q3獲利年衰退上報了嗎？台積電永遠只報好消息，我來當記者好了。,2
15006,1510624505325_F01,台股以盤代替跌，關鍵在這未來10天,建議大家操作台股在這未來的幾天，有幾件事想和各位分享。。<BR>第一：每個人都有自己本身的命運要走，生命定數無法改變，所以本人奉勸大家操作台股別看消息面，別因為利多消息而改變自己操作方向。12月消息最豐富，貨拉來拉去，營收一直有亮點，盈餘是暗點，中國人過聖誕節？<BR>第二：就像地球自轉，再繞著太陽轉，台股漲跌屬自然，人為拉多就會疾速修正，沒有只漲不跌的道理在，每天都在過年，每年都你加薪？<BR>第三： 第一段急殺的利潤最豐富，堅定意志，堅忍不拔，最後才能獲得不歸零的獎勵。<BR>提供給大家回眸一笑。。,2
15079,1510831550588_F01,加權指數又來到季線了..這次...?,現在已經都麻木了<BR>沒有風險意識了<BR>我上網聽了一些今天投顧seafood的錄音節目<BR>少有空方的聲音<BR>不過最近台股比國際股市有比較弱<BR>所以<BR>還是別再進場任何多單好了<BR>即使不賣空也別做多了<BR>是不是這樣??<BR>還是??<BR>怎麼想想辦法賺點錢啊,2
15087,1510887812534_F01,台股如果每季除息,這在美股是再正常不過的事，但在台股，如果這樣做，對於市場或個股會有什麼影響？<BR>天天都在猜這一季收入，不如預期，股價就崩跌？,2
15143,1511028618221_F01,買套房出租，真的好嗎?,假設這兩年，<BR>選股都能看準時機:<BR>嘉聯益18元買進，43元賣出。<BR>加百裕17元買進，54元賣出。<BR>立隆電17元買進，52元賣出<BR>茂達15元買進，53元賣出。<BR>智邦13元買進，106元賣出。<BR>穩懋25元買進，298元賣出。<BR>台半20元買進，80元賣出。<BR>合晶9元買進，44元賣出。<BR>千如9元買進，44元賣出。<BR>華通16元買進，51元賣出。<BR>元太14元買進，53元賣出。<BR>橘子26元買進，97元賣出。<BR>晶電17元買進，63元賣出。<BR>欣銓18元買進，41元賣出。<BR>威剛25元買進，93元賣出。<BR>健鼎40元買進，125元賣出。<BR>原相60元買進，148元賣出。<BR>嘉澤75元買進，228元賣出。<BR>國巨45元買進，295元賣出。<BR>美律30元買進，253元賣出。<BR>致茂48元買進，166元賣出。<BR>創意50元買進，323元賣出。<BR>日友50元買進，230元賣出。<BR>中美晶28元買進，90元賣出。<BR>華新科10元買進，87元賣出。<BR>同欣電60元買進，155元賣出。<BR>玉晶光40元買進，596元賣出。<BR>台光電50元買進，167元賣出。<BR>台積電120元買進，245元賣出。<BR><BR>還需要在新北市買套房出租嗎,2
15146,1511061016084_F01,美股道瓊指數目標價3萬點！？但離25000也不遠了,這本書出來的時候 稍微看了一下 ...依我看 川普的稅改還沒正式通過時 我看美股要大跌的可能性也很小，而且指數行情通常也在半信半疑中成漲，再加上資金氾濫 就算fed 縮表 要升息 也是溫和慢行的 對長期成長有利....<BR>3萬點何時會來 很難確認，但是今年年底全球指數行情應該不至於會崩跌走勢做收，只要川普稅改正式啟動 或許震盪才會加劇 但那也是明年的事了<BR>但比較能夠看的到的 道瓊指數離25000不會太遠 今年或許有機會 ，美股整體在上升趨勢中，台股盤漲行態也再進行 11000也不太遠??,2
