,id,title,content,cluster
18711,1523843970429_F01,徵高手分析6237驊訊,"買了後一直跌， 看不出哪兒不好?<BR>驊訊(6237) 現股買進 已賠-16.52% <BR>新聞說<BR>驊訊 107年3月營收4943萬、年增51.58%<BR>驊訊(6237)3月營收資料(單位千元) <BR> 當月 本年累計 <BR>營收 49,433 147,642 <BR>去年同期 32,612 75,246 <BR>增減 16,821 72,396 <BR>增減百分比 51.58% 96.21% <BR>備註:本公司營項IC產品在電競市場常因電競遊戲之變化而對晶片需求產生供需之轉變。今年因電競軟體音效帶動特定耳機市場需求持續暢旺。<BR><BR>高手幫幫忙， 這支在跌啥道理?",5
18804,1524080409595_F01,[請益] 百和 9938,"這支股票到底是發生甚麼事情? <BR>為什麼外資像倒水般的一直賣?<BR>可是我看融資卻一直攀升, 越跌融資越高, 快六千張融資耶. <BR>這背後是在玩麼?",5
18985,1524543170485_F01,00632R 真的能致富嗎,前男友，8千多點買進<BR>也曾跟我借錢要加碼買進<BR>因為他…<BR>一直相信：這支ETF能讓他變成有錢人<BR>我也曾因為這樣…<BR>拿報章雜誌或網友反駁他<BR>只是他都說…<BR>【那些都只是在騙散戶賣】<BR>【00632R 股本這麼大，代表沒有散戶賣】<BR>心裡是很希望<BR>前男友能“血本無歸”<BR>但又怕結果<BR>不是我想要的那樣,5
19027,1524638394535_F01,放空鴻海有搞頭嗎？？？？？？？？？,想說這支阿斗天天跌 如果放空這阿斗能大賺嗎?,5
19063,1524725435633_F01,關於台南 1473 這支股票,請問版上各位前輩，這支股票從前年跌了至去年儲息前，還配了1.2元，然後就一路跌到今天這可悲的數字，這不是體質算好，健全的公司嗎，怎麼會如此一蹶不振呢？,5
19177,1525068660049_F01,5471即將再起,這支股票是傳統的資優生，但近期一直衰退 ，公司高層應該已經有對應的方法期待今年再起。,5
19191,1525102541817_F01,3406 玉晶光 籌碼的問題？,很奇怪。。。外資 投信 8大行庫 都站在賣方 外加 融券快500張 表示這支妖股 要南下沒錯吧！ 想說 明天放假 來去籌一筆錢 準備拼了 空這支權證 人家說 有夢有去實現 我希望星期一能空在最高點 讓我賺一台黃牌 重機 就好 不貪心,5
19228,1525235409453_F01,當趨勢走長空。。。飆股在起 壓了壓了,3521 鴻羽 這支我觀察好多年了 廢話不多說 買了等領錢啊。。。。。 老話一句 小玩就好 跟單的話盈虧自負 不保證獲利 我是有8成的把握 看漲的 管你大盤趨勢走空 飆股難遇,5
19426,1525805374591_F01,請問富邦美國特別股 ETF 如何？,小弟目前已在基富通投資安聯收益成長基金 美元~<BR>最近看到這支富邦美國標普特別股 ETF <BR>請問這支ETF穩定嗎？<BR>他好像也是股債混合互補的~也請問這支ETF和安聯收益成長相比那一檔好？配息不會配本金呢？,5
19554,1526207142660_F01,2028 威致鋼鐵 股價還有機會過前高嗎？,從前高就一路下滑，想知道有高手怎麼看這支股票？<BR>還會過前高嗎？<BR>全額交割股預計啥時會打開？<BR>謝謝分析建議<BR>（本文不做投資買賣分析或跟單，需盈虧自負）,5
19556,1526216417906_F01,全部家產。。。壓了 這個光 願阿門護佑我,3406玉晶光 這支 我研究了2天 非常看好 今年營收大爆發 個人預估10元以上 所以壓了 家產 給我賺一支愛瘋8plus 就 不貪心 有圖有真相。。。。。跟單的話 盈虧自負 不保證獲利 萬一看錯 我小賠幾千元 就回會砍單阿。。。。。<BR> 老話一句 賠小錢是我賺錢的原動力 才能在股海打滾 多年 走跳阿,5
19591,1526321890632_F01,該是時候進場卡位 訊連 5203 這支股票了!,"The Future is Here, YouCam Launches New “Beauty Advisor 1-on-1” Service<BR>https://www.businesswire.com/news/home/20180514005425/en/<BR>這是我在 Mobile 01 發表的第一篇文章.<BR>很多資訊不方便公告, 低調, 低調, 再低調, 謙卑謙卑在謙卑!<BR>有人已經悄悄的進場了, 大股東 富邦人壽 南山人壽的籌碼已經慢慢轉移給特定人士了.<BR>我只能說這支股票買了就長抱, 別太短視近利, 明年中以後有機會過 183元, 後年股價過歷史天價 298元!<BR>留待日後驗證!",5
19687,1526565068582_F01,主力和外資一直收籌碼??,"這支傳產股股頭注意一陣子了，之前有跑了一趟，小賺，可是發現主力外資默默的買進，於是我也有樣學樣，三天連續買進,法人主力一起來<BR>",5
19915,1527242384932_F01,1402 遠東新 近況?,1402 遠東新<BR>4/30 漲了一根股價衝破28元以後，大概都在28.5上下盤整，本週稍微衝破29<BR>外資每天都買超，但股價就是不太發動<BR>今天還跌了0.5元，且大概在12點半以後才大跌，本來午睡前看還撐在29就想說不管它了<BR>沒想到睡醒一看跌到28.75了...<BR>實在看不懂這支在玩什麼<BR>有人可以解惑一下嗎?<BR>本來目標價30，現在不知道還該不該續抱<BR>謝謝,5
20010,1527568978818_F01,8093保銳 （感言與討論）,這檔預計放到暑假期間，由於技術線圖面來說看似在盤整，為什麼說是看似，內外盤一直在出貨，持有的真的苦不堪言。<BR>會持有原因，短中線來說看好電競類股， 挖礦也伺機而動，這兩個因素不得不相輔相成。<BR>我的問題是，<BR>1. 這支股，主力不斷出貨原因？<BR>還是法人準備謀定而後動（在從低點炒一波）<BR>2. 各位前輩就技術線圖來說，究竟盤整向上多還是向下。<BR>多少有經驗的前輩請別吝嗇留言，小弟洗耳恭聽。<BR>ps: 另外某大四月份大推8093的要不要出來解釋一下,5
20013,1527573401960_F01,被忽略的光學股揚明光,這支股這個月已經默默上漲快1倍了。股價已經超越亞光了。<BR>今日收盤小買2張試試手氣，放著等公布5月營收。（投資有風險，現在是追高，不建議跟）<BR>相信5月營收會是轉折點，若是有賺股價應可維持。,5
20043,1527643862239_F01,請教協益為何一直跌不停,我之前一直想買協益 <BR>但他價位偏高 遲遲未下手<BR>後來他開始狂跌 <BR>跌倒現在30多 我願意買的價位<BR>但現在反而不敢買了<BR>因為他似乎沒有止跌的現象<BR>想請教大家<BR>對這支股票有研究嗎？<BR>現在進場安全嗎？<BR>感謝,5
20102,1527784794719_F01,1536和大,"最近發現這支股,投信連續買超,營收也不錯,且電動車未來趨勢也看好.<BR>不知道有沒有高手接觸過這支股票,現在價位適不適合入手呢?",5
20106,1527805502508_F01,統一基金,第一次買基金，聽家人的建議已經買了統一大滿貫，但最近還沒時間研究基金買賣，今天看到有一支新的，統一大東協，想詢問這支是不是也可以參考一下,5
20317,1528470068093_F01,石油在漲。燃料電池會有市場嗎？,8996高力。這支在做燃料電池。最近環保因素。石油又在漲。這燃料電池。後市看好嗎？,5
20469,1528957082424_F01,大家對華容5328有什麼看法,"最近入手了華容15張漲停了兩天,開始人工分盤跌停,入手價大約21元,不知道會不會入手太晚了,大家對於這支後續看法如何",5
20476,1528969420846_F01,請問借卷對股價影響,各位前輩，小弟今天收到手上這支股票的借卷要求，因為對借卷不了解加上時間匆促沒有同意<BR>想請問借卷會對股價造成影響嗎？ 謝謝~,5
20492,1529026893748_F01,4144生醫股,這支壓縮到最後<BR>快表態了<BR><BR>主力很刻意<BR>大盤不好時<BR><BR>這隻反爾會漲<BR><BR>盈虧自負,5
20580,1529376951636_F01,2345智邦 討論區,這支 大家如何看呢~? 感覺也滿穩定 來討論看看吧!,5
20702,1529718800907_F01,3144新揚科當沖被殺了,一早開盤忍住沒追高，趁小跌買了36.5，20張，盤中一度大漲至39.75，當下賺了快5萬多，心一橫貪念起，沒賣就去工作了，趁下午休息偷看收盤狀況，滿心期待的漲停，心想今天可以帶全家大小吃大餐，結果。。。。。。。。。。啊。。。啊。。。。怎麼會這樣。。。。。賠慘了，有高手可以幫忙分析這支的後續嗎？我要認賠了嗎？,5
20806,1530002171389_F01,伍豐(8076)各位怎麼看?,看這支這幾天一直在跌<BR>是否有漲回60的機會? 想知道各位是怎麼看的??<BR>謝謝!,5
20860,1530140274095_F01,賴英里辭寒舍董座,我一直有在關注這支寒舍，想不到寒舍女CEO這麼正！！！<BR>,5
20911,1530252189328_F01,有前輩們可以指導一下光寶科(2301)這檔股票嗎?,各位前輩好...<BR>小弟我是股市新手六月初開始看得<BR>最近學著看一下大盤漲跌走什麼趨勢<BR>很好奇光寶科這檔股票為什麼不論大盤漲跌<BR>他都只會跌一點點<BR>而如果跌太多又好像故意被拉回來...還是這檔本來就是這樣呢<BR><BR>我為什麼會看上這支呢<BR>因為我看排行上的玉晶光前陣子漲得很誇張<BR>當然國巨那些也是漲得很誇張，只是礙於預算跟經驗不足<BR>之後在看盤軟體上的鏡頭類股就選這檔來關注看看<BR>加上這支還有在台灣50裡面<BR>配息好像也有快3元<BR>看了新聞他又跟互聯網的未來似乎有相關<BR>感覺很有未來<BR>照這個月的波動股價一直都只會跌不會漲<BR><BR>爬文有說看什麼本益比 EPS<BR>結果看上南亞科也是算優質的吧<BR>股價也是從近百跌到今天83<BR><BR>不知道有沒有剛踏入股市的前輩一開始也有這種疑問可以分享經驗的呢,5
20957,1530421678579_F01,瀚亞投資-M＆G收益優化基金,大家好:<BR>這支基金有美元、英鎊、歐元計價，不知道大家推薦哪個幣別好?<BR>要穩健的話是美元，但是我看英鎊從60到現在40元、歐元從50到現在35，是不是比美元值得下手呢?<BR>謝謝大家意見~,5
21163,1531115406078_F01,5223 安力ky,請問有前輩看這支嗎<BR>7月2號上櫃。 營收成長跟前景也看好 <BR>今年發2塊多還不錯 在第二天40元進2張<BR>然後就一路跌@@ 今天還跌到亮燈是有什麼利空嗎 會不會一路跌到27…,5
21183,1531192334232_F01,2338光罩破30塊了!!,"2338營收這麼漂亮, 想不到股價無支撐, 昨日向下突破MA20線後, 今日再向下走了, 還有股民留著這支股票嗎? <BR>",5
21234,1531360205323_F01,2480 敦陽科,7月營收不錯<BR>看線線型不錯...<BR>有人關注這支嗎<BR><BR>設好停損點<BR>目前看多<BR>5日線將突破20日 勝率頗高,5
21266,1531411840044_F01,00637L交易量好大呀!!,"比起其它ETF, 00637L交易量大的驚人, 每天都有幾萬張買賣, 今天成交了14萬張, 這支ETF怎麼這麼熱門?",5
21530,1532340220463_F01,元大金看法,各位前輩大家好<BR>我是剛入股票的新手<BR>想知道各位對元大金這支的看法<BR>謝謝,5
21543,1532360121712_F01,2313華通...,各位大大，有人還在被這支套住嗎? 雖然小買而已，但是一直跌也不是辦法...請問認賠或換股會不會比較好? 感覺這支已經要崩壞了，回不去了,5
22115,1534297191763_F01,版上不準別發文害人還空氣單加碼樺漢6414 已經三根跌停板...原萬寶目標財富自由 消失了??,這個原萬寶目標財富自由<BR>好像很準一樣<BR>一發文 結果???<BR>你可以不噴沒關西<BR>但跟你對作才爽賺要說阿 你文章說這檔會破千<BR>8/13大跌你又喊加碼 空氣單加碼!?<BR>不準還能狂發文 ..管理員處理下這支害人的行為<BR>很多版友留言跟他說要看對帳單 他都黑單別人說別人在抹黑他<BR>媽的....一張賠上萬<BR>你為何不敢給對帳單?<BR>講的準可以不可 你不準還不給 太扯 各位小心<BR>,5
22116,1534297329509_F01,怪股現形記--凌陽,"這幾個月發現一支怪股, 預搓合時都有一筆 499的單掛漲停買, <BR>到了8:55分後就會消失, 觀看他的業績, 很不怎麼樣, 這筆499的<BR>單似乎是在暗示有人有撐, 吸引一些不小心誤入歧途的投資人進來,<BR>當然獲利不等於股價, 這支要小心, 不要變成最後的抬轎者!<BR>與大家共勉之! 希望499的單真的買進!",5
22117,1534298382454_F01,00635u元大黃金有人做嗎？,<BR>我是奉行散戶接刀術。接在18.12。<BR>想請問一下？這支有跟反向的一樣有自動扣血功能嗎？,5
22118,1534298695267_F01,微星是怎麼了？,有人在研究這支嗎？外資一子在出貨！,5
22305,1534863606631_F01,8049 晶采 有沒有機會,8049 晶采 都沒有什麼新聞 最近想買進<BR>各位大哥 這支是否有機會,5
22341,1535007430265_F01,6277宏正ATEN,"看了2個月的遠東新.新光鋼,還沒上車就開走了~<BR>6277宏正這支看半年,最近想上車!<BR>覺得近可攻退可守.<BR>這支有5G概念嗎?<BR>股價從100又回到7字頭了,沒有大利空可股價為何波動?<BR>大家幫看看有沒有我沒看見的利空~<BR>感謝!",5
22375,1535089509629_F01,2838A 聯邦銀甲特 股利詢問 2018配息,http://pchome.megatime.com.tw/stock/sto3/ock1/sid2838A.html<BR><BR>請問一下有誰買這支? 號稱年利息4.8%<BR>可是我到網站看 今年才配0.4537$ <BR>有沒有搞錯? 這樣怎麼會有4.8% ?,5
22645,1536191823286_F01,最近被問到的幾支個股，發現都已經由高點反轉，希望大家避開,您若有個股問題，可以私訊，在時間允許之時，會盡力為各位解答<BR>下列幾種類型的股票，供大家參考<BR><BR>這支標的好多人問，持有的朋友們，非常希望大家能避開，以免受傷<BR><BR><BR>這種類型的股票也很多，底下的持股變化已經很清楚的告訴你，大戶在烙跑了，眾多投資人還是執迷不悟，非要攤平<BR><BR><BR><BR>其實很希望有投資人提問的是這種類型的股票，但是似乎非常少投資人提問這種類型的標的<BR><BR>,5
22789,1536667995649_F01,2028 威致 看多還是看空,2028 威致 鋼鐵類股 EPS打趴同業<BR>目前注意到，但股價感覺低迷，但算止跌<BR>有人注意這支嗎？<BR>謝謝,5
22807,1536763970747_F01,2380虹光,"各位30cm,百萬富翁大大<BR>有人抱著這支股票的嗎 ?<BR>原本以為盤了很久會開始升旗了 ,<BR>目前看來應該是陽痿了 ..",5
22990,1537869490131_F01,"台塑化成交量7845張,漲幅5.8%","這支籌碼被鎖緊了吧,成交7845張大約12億台幣,市值增加762億台幣<BR>好犯規的股票,以後拉抬台塑4寶就行了吧",5
23037,1537882988979_F01,4960誠美材,今天來到9.75新低<BR>這支能買嗎?<BR>看新聞都說明年有希望漲回<BR>如果原本有持有股票<BR>需要快賣掉嗎?,5
23044,1537895448967_F01,問個笨問題台勝科,上一次的收盤約79塊<BR>今天恢復開盤直接漲停163塊<BR>那是否上次買79塊<BR>今天就現賺約8萬元了<BR>不懂股票也沒買這支,5
23048,1537933789262_F01,請教欣興電子(3037),想請問為何欣興電子這支股票，在最近四年(2015~2018)，盈餘分配率都超過100%呢?<BR>2017年最誇張，盈餘分配率高達2985%，這是什麼樣的狀況有人可以幫忙解答嗎?感謝,5
23168,1538487314952_F01,大家對聯強這支看法如何,最近在追縱聯強這支<BR>最近股價跌很多<BR>前半年賺2.26<BR>股價37.75<BR>估起來本益比不到10倍<BR>不知為何<BR>這支好像很冷門<BR>很多地方都沒人討論著<BR>目前我還沒持有<BR>請問各位有有何看法<BR>謝謝,5
23195,1538623907879_F01,聯博歐洲收益aa 美元避險,"https://www.fundrich.com.tw/fund/029029.html?id=029029#%E9%85%8D%E6%81%AF%E7%B4%80%E9%8C%84<BR>想請問達人這支如果歐洲升息或歐元升值，淨值與配息率的走向?<BR>目前配息升到8%,是受到美元避險的關係。<BR>不知道我的理解是否正確?",5
23225,1538665586235_F01,華邦電繼續跌嗎,華邦電續跌慘啊，有人一樣有這支嗎，是否要殺出，實在殺不下去啊。,5
23271,1538897949692_F01,7504時尚美人可以買嗎?,時尚美人生物科技，主要業務為經營Beauty88時尚美人網路購物商城，該公司之網路購物平台結合網路開店系統，讓商家可以輕鬆地在其平台開設網路商店。<BR>且平台之模組化功能亦可解決商家之進貨、管銷、文宣及庫存管理等事務，使創業開設網路商店更容易。<BR><BR>這支可以買嗎?,5
23283,1538925578401_F01,遠離2640台灣大車隊股票,"儘管表面上獲利看起來不錯,股價卻跌跌不休,<BR>我只能說這支最好別碰為上,除了uber的可能衝擊之外,<BR>還有一堆虧損的轉投資包括已經由盈轉虧的全球快遞,<BR>以及像是西門町旅店,汽修公司..等等,<BR>眾多經營不善的副業恐怕才是更大的潛在地雷,小心為妙.",5
23352,1539166065703_1_F01,HTC 股價已跌到34元，大家研判後勢如何?,HTC 股價從最高點 1300元跌到如今剩34元，為何股價會跌這樣多? <BR>大家研判這支股票未來有無機會重回 1300元?,5
23398,1539240094590_F01,穩懋漲停?!! 3105,誰可以告訴我這是怎麼回事?!<BR>萬綠叢中一點紅，從跌停拉到漲停<BR>難道護盤是護這支嗎?,5
23438,1539318108239_F01,請問Gogoro有興櫃嗎? 中文名是甚麼呢? 狗狗弱嗎?,"請問Gogoro有興櫃嗎? 中文名是甚麼呢?<BR>該不會真的叫 ""狗狗弱"" 吧<BR>這支股票未來一定很棒!!<BR>或是有沒有相關股票呢? 請前輩提供一下<BR>不然今天已經虧很多了...",5
23515,1539576065739_F01,【不存了，但也上了! 衝! 】請教長榮航(2618)值得存股嗎?,國際油價有漲有跌，近期好像會大漲的感覺<BR>不過看長榮航現在價位只剩 14不到<BR>而且財報雖然沒很亮麗，但好像也沒差到那裡<BR>而且也近年底了<BR>請問這這支適合存股嗎? 大家看幾元價位適合進場? 離場?,5
23770,1540314502586_F01,關於樺漢股價,前一陣子在看樺漢這支，不知為何他的股價可以由原來的400多塊跌到現在200初頭(已經掉6成多了)<BR>但我看他公佈的財報合併營收都是一直新高呀?<BR>小弟我是股海新手，經手過的股票一隻手數的出來，關於樺漢實在是不明白其中的原因，還請高手幫忙解惑一下,5
23820,1540442785605_F01,關於台灣特品 （台特）,想詢問各位大大對於這支股票看法...<BR>最近接到直銷電話，雖然沒買單<BR>但對方說的好像很厲害？,5
23989,1540829890377_F01,4413飛寶企業,哈囉 請教一下，前陣子抽籤抽到，飛寶企業，想請教一下這支股票何時才能開始買賣交易呢？感恩,5
24026,1540950534205_F01,2723 美食-KY 這支股票後勢怎看呢?,2723 美食-KY 這支股票後勢怎看呢? 今早跌到185了,5
24170,1541481403421_F01,康友-KY 怎麼了???????,"這似乎是個不能說的秘密 <BR>融資斷頭...<BR>權證報價超扯...還熱賣...<BR>分析師好像被下封口令, 不能提這支股票.<BR>不知道何時才會敲開跌停???<BR>",5
24199,1541576288981_F01,00692有人對這支ETF有研究嗎？,有人對這支ETF有研究嗎？<BR>感覺量起不來？<BR>不敢下手！,5
24214,1541641014600_F01,基金的績效是往上升的淨值卻是往下掉~ 這是什麼意思?,這支基金我在想該不該保留? 但看不懂啊!<BR>,5
24219,1541648303605_F01,東元接刀,本宮就看好台股站穩萬點，<BR>決定加碼接刀東元，<BR>這支應該適合長抱吧?<BR>有沒有比聯電好一點<BR>投資要選對股，<BR>才能睡的安心,5
24238,1541692332795_F01,昂寶-KY,如題????<BR>昂寶-KY<BR>請問、有人有操作過這支嗎？？？,5
24258,1541753502831_F01,連主管都找我聊康友....,最近火紅的康友，<BR>其實是主管跟找我聊，<BR>我才知道有這支的..<BR>只是好奇這檔怎麼可以這樣漲跌，<BR>連金管會也在看戲嗎,5
24314,1542002776062_F01,博錸(6572）這支生技股,這支生技股每個月營收在增長中，現在股價15元，值得投資嗎(後市狀況看好嗎?)<BR>https://www.cnyes.com/presh/finreport3/6572.html,5
24409,1542271048974_F01,3219倚強減資問題,想問一下這支股票最近說要減資<BR>但我怎麼都查不到是幾號要減資呢?(減資要停牌半個月)<BR>有高手知道的嗎?<BR>感恩,5
24457,1542422586835_F01,天呀! 這支上看40元,<BR>就算10/11崩盤，<BR>這支股票竟然能漲回去，<BR>甚至一路向北，<BR>果然是高鐵，<BR>沒人速度比它快<BR>與其買聯電，<BR>不如買高鐵,5
24519,1542677785041_F01,關於王道銀行甲特,有人研究過這支股票嗎？<BR>一一 一 一一一一一一一,5
24676,1543297644246_F01,“貨出得去”概念股-正德海運,兩岸貨運直航業務一直穩定成長，這波高雄概念股飆漲似乎遺忘了還有這支股票，便宜有轉機，大家可關注！,5
24699,1543368613233_F01,抽籤科定,想請問~~第一次中籤抽到科定<BR>當初是市價73元 昨收盤價72<BR>為何今天第一天上市變成60元<BR>當時承銷價是60多 這樣等於抽中這支是賠錢的<BR>怎麼會這樣 有大大可以幫我解惑嗎,5
24708,1543382158410_F01,達方,達方8163建議多少買呢<BR>這支在持續不斷往上飆升 已經轉虧為盈了,5
24780,1543584637886_F01,6558興能高中籤了,<BR>雖然離上市12/5號還有2個交易日<BR>但目前的價差還滿不錯的<BR>算是生活中的小幸運<BR>這支各位看好嗎?,5
24800,1543677356923_F01,玉晶光 破底翻漲!？火山大噴發了bro玉晶光，底部破底，要噴了嗎?,小弟最近有注意這支小股，玉晶光<BR>以各位獨到的眼光，是否會跟進呢？,5
24825,1543802451036_F01,請問 「欣興」3037這支股票如何？,請問 「欣興」3037這支股票如何？<BR>有點想買,5
24838,1543819551437_F01,茂矽現金增資,茂矽是我第一張股票 當時買的時候是41元 印象中好像從來沒配股息 <BR>陸續有有增資減資 <BR>昨天收到現金增資認股通知 一張1000股的股票 現在只剩22股 <BR>要求我認股 每股20元 最後繳款在12/6<BR>請問可以認股嗎 ?<BR>這支股票還跟胡洪九有關係嗎? 有起死回生的能力嗎?每股20元有這個價值嗎?<BR>印象中這支股票只會騙投資人的錢 別的半導體賺錢 他賠錢 但是又部會倒 就是全額交割減資增資輪迴<BR>我傾向是不繳錢,5
24864,1543899657669_F01,鴻海一定漲吧？,好久沒看他，<BR>跌到這麼低了，<BR>本益比不到九倍，<BR>跟去年比基期又低，<BR>由郭董領軍，<BR>抱個兩年，<BR>漲到將近一百不是問題吧？<BR>越多人反對越安心買，<BR>反對的人都沒持有這支股票了，<BR>就沒得賣，<BR>沒人賣就不太會跌了。<BR>但是這些看法只是參考，<BR>自己下判斷自己負責吧？<BR>不要每次賺到錢都說自己好棒棒，<BR>賠錢都說別人害他。<BR>會怕的話就少買幾張，<BR>要不然就不要買，<BR>股價是信心問題，<BR>不是真實價值。,5
25032,1544439250194_F01,3527聚積....,聚積近來很強勢<BR>有人知道這支是怎樣了嗎...,5
25209,1545288377762_F01,2536宏普,找了這支穩定高殖利率的想存股，但觀察最近幾年的ROE和EPS好像都越來越低…<BR>上禮拜每天開盤都走低，收盤又衝回原盤<BR>有人有研究嗎～目前存兩張均價19.75,5
25338,1545472553966_F01,今天開始模油的底，勝算多少啊！,油價漲一年多，三個月就跌回來，這支ETF槓桿大，漲跌也大，往下買，不知道時間會不會幫我。,5
25514,1546050172661_F01,00712 (復華富時mREIT ETF) 年化配息7％,有人觀察00712嗎？<BR>這支跟REM一樣是mREIT<BR>但是內扣比REM便宜<BR>不過規模有點小<BR>成立剛滿一年左右<BR>成分股比例跟REM差不多<BR>2018殖利率也有拿到10%<BR>可以拿REM歷年報酬回測參考<BR>REM 08-18年 定期報酬年化7.5％<BR>只是不知道這支是不是跟REM一樣會扣30%跟匯率避險,5
