,id,title,content,cluster
5850,1473389975109_F01,"全球大咖資金可能正拋開比較利益投資法則,轉選低風險資產","美國大選在即,大咖資金以往的歷史是半年前就漸漸將資金抽離股市.<BR>今次因錢實在太多,七月初走末升創高,橫盤2個月慢慢出貨,未來那棵大樹會先倒.<BR>按照台股慣例,散戶會不斷逢""低""承接,政府也不斷護盤,聯手幫外資順利出貨.<BR>加上陸客不來,軍公教消費緊縮帶來的乘數效果,經濟很可能坐上向下的大怒神....<BR>年底台股下看......<BR><BR><BR><BR><BR><BR>誰知道呀!",2
5852,1473402457668_F01,該注意陸股了 台股差不多了,520前我就強力放送 台股520後利空出盡 會往上 現在還沒走完 但操作變難<BR>9/20還有美股升息干擾<BR>今天 送大家一個禮物 盈虧自負 金九銀十<BR>陸股這波沒上去 要等很久了 等訊號 <BR>可買標的 0061 FB上證<BR><BR>陸股周線 有沒有跟台股很像 一底比一底高......,2
5863,1473431266330_F01,美股再度重挫，說好的20000點呢......,一直想看美股創新高，<BR>但卻站不穩18600，<BR>美股這波重挫，<BR>恐下探17800<BR>九月不太妙<BR><BR>,2
5869,1473475412510_F01,猴賽雷...台股甚麼線破光光,今天...沒錯 趕緊來去空吧........... 美股狂瀉 ............ <BR> 造就 空軍 起飛................... 台股下看8*** <BR> 外資 星期一 一定狂賣.................. 所以 結論是 <BR> 空吧 空吧 人手一張空單 ...........,2
5874,1473481577976_F01,發現新指標,某人被01關了60天，台股天天漲，最近放出來了，台股幾乎都是跳水局面，準到不行,2
5880,1473516648668_F01,台股今天大跌 是因為 被韓核試嗎？,台股今天大跌 是因為 被韓核試嗎？?????<BR>是嗎?,2
5886,1473573546582_F01,跌一百多點成交量四百多億！,到底是散戶惜售<BR>還是台股真的只剩外資在玩<BR>佔了40啪。。。都是外資在控制了,2
5892,1473598975414_F01,恭請8000大開示！！,明日即將到來，又遇中秋連假，台股漲或跌，狀況不明，可否請8000大協助開示，謝謝。,2
5894,1473612215878_F01,明天開始我要進場護盤了,請大家不要過度擔心台股，<BR>目前哀家仍看好未來三個月的史詩級大逆轉<BR>接下來三天內，<BR>我將分批進場,2
5907,1473653586905_F01,??又到了賭的時刻了，先彈再說★★,台股現貨大盤又再次回到頸線了，不管中秋假期是否變盤，放假前明後天先小小彈一下，<BR>多小台看有沒有機會領個中秋禮金<BR><BR>以上就是天方夜譚，請勿當真,2
5912,1473671728149_F01,"8K神又被盯上,發文來不及看就回收了.","才剛上mobile,人氣王發文馬上回收,都還沒看到,<BR>不過台股管妹抓得很準,<BR>把8K神關警閉,台股馬上上漲9000多,<BR>放他出來,唉!要變盤了,<BR>台積180多又掉回,<BR>台灣反50有機會上漲了<BR><BR>台灣反50想買中...<BR>上次被咬,想咬回來.",2
5927,1473744469230_F01,股市2016/9/13記錄,2016年美國總統選舉於2016年11月8日（星期二）舉行，此次是美國第58屆總統選舉，同時眾議院全部435個席位及參議院33個議席也會進行改選以產生美國第115屆國會。選舉人團將首先被選出，再由選舉人團於2016年12月17日重新正式選舉產生總統和副總統。現任總統巴拉克·歐巴馬已當選兩任總統，依據美國憲法第二十二修正案，無法競選連任。<BR>1長線上，也許是8200<BR>2暫時粗估台股11月落底，合理價位在8450左右以迎合美國總統大選2016/9/13記錄<BR>3月線時間波巳到，下跌的速度可能是相當快,2
5936,1473773950951_F01,中秋變盤？大戶：Q4迎旺季 七檔科技股逢低買,中秋變盤？大戶：Q4迎旺季 七檔科技股逢低買<BR>高科技股必然是這波回檔修正後很好的投資標的，台積電、聯發科、祥碩、研華、大立光...都是獲利佳，產業趨勢對的企業，逢低承接不會吃虧。<BR>大家參考囉,2
5941,1473792002668_F01,"資金行情裡的資金都走了, 你還不跑嗎?","大部份的國家股市真正反應景氣面的都沒有, <BR>反應都是寬鬆的資金行情, 因為央媽大力購買公債,<BR>造成公債流動性幾乎有行無市的情況, 而價格溢價的情況愈驅嚴重, <BR>造成投資人為了追求更多的報酬, 只好轉投資股市... <BR>而這波股市舉台股來說, 只要是配息較穩健的股票幾乎都漲了一大段.. <BR>但可忘了, 股市最大的利空不是升不升息, 而是漲太多... <BR>莫明的幾個人講了要升息, 大家就跌了? <BR>而且是股, 債, 原物料, 貴金屬... <BR>而匯率都沒有反應這麼大?<BR>這情況是否是萬物皆跌? 資金退潮呢? <BR>翻開過去幾段資金行情之金融風暴的經驗, 只要沒走掉, 最後都很慘... <BR>散戶不比法人, 法人玩得是散戶的錢, 自己要懂得控管好資金, <BR>不景氣時代錢難賺, 如果資金被卡就很難再全身而退... <BR>我簡單舉個例子... 台積電..<BR>雖然 Apple 很甜, 但不能產能全包, 再加其它競爭對手都在挖重要客戶... <BR>當這些重要客戶愈來愈不賺錢時, 為了淨利, 改抱其它競爭對手也不奇怪, <BR>產品也區別化來放在不同的籃子裡... 目的就只有一個... 砍價... <BR>所以台積電過去幾季, 其實錢是愈賺愈少? 怎麼股價卻愈漲愈高呢?<BR>這檔股票可說是資金行情最好的代表... <BR>台灣如果只靠一個 Apple 的話, 那千萬一定要跑... <BR>因為 Apple 不是神! iPhone 7 也不是神! 因為智慧型手機的市場已經接近飽和.. <BR>再加上 iPhone 6 以後已經不是殺手級創新或改革了, 真得要小心淪為外資提款機... <BR>",2
5993,1474080041374_F01,警告︰外資愈喊愈高！！！ 投資人小心！！,受到美股連動影響，台股從高峰急轉而下，財信傳媒董事長謝金河發出警告，要投資人小心這種因為「資訊不對稱」引發的快速變動。<BR>謝金河一早在臉書以「小心股市的資訊不對稱！」為題，<BR>發表股市觀點，他指出，最近外資在台股加大力道賣出，包括台積電，大立光，最近都出現明顯賣超；而最值得玩味的是，外資對目標卻是越喊越高，如台積電最高喊235元，大立光喊5100元，其實，今年大立光已大漲，到3945元年線乖離大，台積電到185元，也是如此。<BR><BR><BR>謝金河指出，「宏達電漲到1300元的過程中，外資有喊2000的，兩年前，外資喊力旺750元，到現在都沒有出現過。這種股價到了高檔，目標價卻愈喊愈高的現象，正是股市投資人最要小心的時候」。<BR><BR><BR><BR> <BR><BR>先跑為妙......................<BR><BR>萬般拉抬為出貨....................<BR><BR>,2
6004,1474124058416_F01,9000點上放空大盤，在未來一、二年裡有勝算嗎?,小弟想拿20萬，玩小台放空，以前波高點9200為基準，若最近有達到9200點即放空小台2~3口，依歷史走勢來看，被軋一千點的機會應該微乎其微，但往下卻是時間遲早的問題，只是也很難說不過破萬點，但依台灣的經濟情勢來看，毫無理由有上萬點的基礎~~~~<BR>請教板上的前輩們，這樣的想法，在台股目前走勢來看，贏面多大??,2
6054,1474354018740_F01,打房打掉的錢都流到哪去了呢?,看到打房的新聞突然想到，房地產差不多跌了兩成(新聞說的，有錯別嘴我)，投資客很多都退場，但股市卻不見有相應的漲幅(台股8000~9000震盪很久了)，然後新創圈的投資好像也沒變多，揪竟這些資金流到哪去了呢?國外嗎還是存銀行了,2
6056,1474356722843_F01,"請問美國FED升息,台股200%必跌嗎?","請問不論是9月還是12月美國FED升息,台股都200%必跌嗎? (下修500點那種)<BR>如果真是這樣,那現在準備布局空單不就穩賺的?? <BR><BR><BR>市場不是應該具有不可預測性嗎......?",2
6101,1474508009307_F01,台股全面大漲，信心十足,由此可證，<BR>前幾天確實是假跌無誤!<BR>接下來台股目標將會是9600，<BR>只要一過，<BR>萬點行情將勢不可檔<BR>再加上11月又有大媽行情，<BR>依我看台股現階段並非真正高點,2
6128,1474603421202_F01,"台股都沒人玩了, 只剩外資自己每天在打手槍","如題, 高點到了散戶沒人敢進場, 台股現在每天只剩外資在撐場面.",2
6193,1474938550333_F01,看好明年台股上萬點,大會報告，<BR>最近這個預感越來越強烈了，<BR>經過我獨步分析，<BR>在今年底要上萬點的機率是非常渺茫，<BR>只有整理再整理，<BR>很多人等待著崩盤，<BR>也遲遲未到，<BR>看來台股正準備在為明年做打算<BR>從今天起，<BR>我將重返股市，<BR>準備迎接我看好的《2017》<BR>為了讓各位充分了解股市，<BR>將不定期透析台股<BR>接下來我們要等什麼?<BR>1.美國大選11/8<BR>2.中國大媽錢進台股，11月?<BR>目前看似只有這兩項能影響台股了，<BR>剩下的都是整理再整理。<BR>總結:<BR>2016年台股重要指標就是「整理」,2
6202,1474986406429_F01,明天颱風不開盤了,"放半天被罵,馬上放整天,<BR>現又多放一天颱風假,9/28 本要辦的事情又要delay(要繳補充保費,想說XXX),<BR>台股不開盤,真不知是好是壞???",2
6228,1475119351574_F01,為什麼理財版這麼容易被刪文?,已經好幾次沒連續發了，還被刪!<BR>請問每個版都是不同的版務在管理嗎?<BR>在其他版都沒被刪文過，<BR>這個版是不是太過於嚴格了?<BR>再這樣下去恐讓我完全失去分析台股的動力,2
6243,1475159395807_F01,請問現在是景氣循環的波短起漲點嗎?,"請問現在是景氣循環的波短起漲點嗎? <BR>1.景氣對策訊號已從谷底爬起~<BR>2.很多龍頭權值股,Q2的EPS都比谷底的Q1成長,接下來的Q3也不會差到哪去~<BR>3.台股被熱錢買到9300點了,本益比卻還是比鄰國低(現階段台股殖利率仍有4%,比起鄰國2-3%的水準明顯較高)<BR>4.大多散戶還是在看空猜頭的樣子...",2
6289,1475384124738_F01,台股明天是不是要噴出了............................................................,美股大漲164點 人民幣正式納入SDR 中國債市要牛逼了.<BR>台股禮拜一 該不會要噴上9400了,2
6290,1475385778313_F01,指數9000點，明年台灣股利殖利率還逾4%，亞洲最高？,很難理解，大環境沒有好轉，但是企業股利沒有降。總體盈利有增加嗎？還是沒有和總經有強相關？在全球負利率不變的前提下，這總殖利率是不是變台股下檔有守的護身符？,2
6328,1475623338301_F01,剛剛才知道。。金融超貸案,金融股。。兆豐 好像有問體 超貸金額給 那個字打不出來 什麼泰 伊什麼的 重點是台股我一片看好 但如果因為這事件 重挫 我又要吃統一麵 配麥香紅 過日子了,2
6345,1475661339649_F01,請股市高手幫忙 看一下 8443 阿瘦 算是底部爆大量? ?,請股市高手幫忙 看一下 8443 阿瘦 算是底部爆大量? ?<BR>只是因? 台股可以當沖 尾盤就被砍下來 <BR>是這樣嗎 ? 幫解答,2
6370,1475777337907_F01,最近台股交易量怎麼這麼低?,最近台股交易量怎麼這麼低?跟去年比4個交易日減少超過1千億 <BR>241879920744-349279657902=-107399737158<BR>,2
6371,1475794379644_F01,踏入股海，連續套牢三年...,到現在還在套，<BR>以一般散戶來說，<BR>這樣正常嗎?<BR>不知道還要套到民國幾年，<BR>只要打開持股一看總是滿滿綠字，<BR>從剛開始的緊張、坐立難安、夜晚難眠，<BR>到現在已經麻木不仁...<BR>正在耐心等待台股上萬點，<BR>看會不會好轉一點<BR>今年即將結束，<BR>看來又是套牢的度過了。<BR>有時到了深夜，<BR>總是會問自己，<BR>「明年會解套嗎?」,2
6381,1475829540902_F01,假設今天樂陞違約案是發生在台積電??,"如果今天樂陞違約案是發生在台積電:有人原本要收購台積電,然後也發現違約了.那股價也會像樂陞這麼嚴重下跌嗎???又會是怎樣的情形發生呢???",2
6416,1476019365829_F01,股票 股利的算法？,目前的投資大部分都是買投資型保險<BR>對於股票一概不通<BR>但是很久以前就已經有注意到台積電的股票<BR>從剛出社會 <BR>好像全球經濟泡沫還是SARS<BR>台積電 一張最低有看到好像 42元吧<BR>到最近又看到 台積電一張已經188的樣子<BR>想請教各位大大<BR>如果我是去年1月買了10張(155)台積電的股票的話<BR>到目前 股票加股利 所有淨所得大概會有多少？<BR>知道絕對比存銀行好 <BR>但是不知道差距有多少？<BR>謝謝各位,2
6424,1476077958411_F01,金融市場的動盪,黃金跌 英鎊崩 人民幣離岸匯率跌 美元兌日圓升 美國10年國債利率上升 美國實施新的貨幣基金監管新規<BR><BR>這些對台股的影響，有前輩能說說你的看法嗎！,2
6434,1476153647189_F01,台股重挫了..,原本獲利上萬的..<BR>剛才突然一看變幾千而已...<BR>歷年雙十連假後，<BR>台股都重挫嗎？<BR>,2
6453,1476230953136_F01,我昨天買了一張台積電的股票,生為屌絲來說，雖然不是什麼大錢，但是對我很大了～ＸＤ。<BR> 為什麼會買呢？<BR> 買時總有那種現在升很高了，等回下來再買的聲音漂過。<BR> 不過問題是～９Ｘ塊時就漂過，１２Ｘ也是，１５Ｘ也是，想想～想買就買吧。<BR>－－－－－－－－－－－<BR> 當然買前也有做些考量。<BR>１，台積電主要是外資買的，我認為外資比我聰明，他們認為值得這價。<BR>２，ＮＶＩ的新一代顯示卡，台積代工，基本上做到了微縮製程和增加效能，對照組則是ｉｎｔｅｌ。我看好它的技術。<BR>３，台積的進步很快，雖然同製程來說其實微縮率不如ｉｎｔｅｌ，但是進步比ＩＮＴＥＬ快多了，兩年內大概就會成為製造晶片技術第一的公司。<BR>４，ｎｏｔｅ７的爆炸事件，這件事將會大大拖慢了競爭對手三星的腳步，使其將會更沒競爭力，本來就不如台積了，之後可能看不到車尾燈了。<BR>－－－－－－－－－－－－－－－<BR> 會賺嗎？我也不知道，不過個人買股票會抱著買下就是準備抱五年，如果沒有什麼太大狀況的話。,2
6460,1476246368709_F01,神奇的台股,不知道是什麼原因可以讓台股漲成這樣，全亞洲都在跌，就台股最強了,2
6463,1476250711884_F01,黑天鵝和白天鵝誰比較多?,"今年台股下半年似乎一直維在8800~9300水準<BR>大家認為全球股市和台灣股市未來半年看多看少?<BR>主要原因為何請列舉原因,謝謝!!",2
6465,1476261734201_F01,今天收盤前下了空單，這樣算勇敢嗎？,大家都知道台股指數雖然來到高點，但卻尚未轉空，明天又是台積電與大立光法說會，我這樣冒然空下去，是不是衝動了些,2
6473,1476293939762_F01,6209今國光走勢,這幾天的走勢覺得蠻有趣的<BR>國慶日隔天沒多久跟著台股一起隨便殺<BR>結果收回平盤之上<BR>外資大買兩千多張<BR>只是有意要拉的主力好像都刻意拉開盤附近而已?<BR>今天也站上前面高點<BR>15日線也破22日線<BR>不知道大大們有什麼見解,2
6474,1476304699912_F01,外資的銀彈,"華亞科及漢微科退場後, 外資將取得1500E資金. 這些資金將會重新投入台股或匯出可能影響指數走勢.",2
6491,1476363268284_F01,2016年台股上市櫃9月營收報表 出爐啦！～,"嗨！各位高手，<BR>炙手可熱的9月份營收出爐囉！<BR>近1600檔全部收集在一個檔案裡，<BR>趕緊找成長爆發股吧！<BR>檔案載點：2016年台股上市櫃9月份營收報表收集<BR>資料僅供參考，實際以公開觀測站、證交所公布為主。<BR>祝各位股市大賺～ ^^<BR><BR>經過一個晚上，一醒來接到許多人的反應說無法下載檔案。<BR>經過確認原來是Google有限制一天下載容量超過1.2G就無法下載了。<BR>這個檔案大小有2MB能在一夜超過這個數量真的很驚訝！<BR>目前想到的解決辦法是將同一個檔案分割成6個，<BR>這樣就能符合google規定又能讓大家下載了！<BR>底下是6個分割檔，6個都要下載喔！<BR>下載完畢後，解壓縮任一個檔案即可。<BR><BR>2016台股上市櫃9月營收報表 分割檔1<BR>2016台股上市櫃9月營收報表 分割檔2<BR>2016台股上市櫃9月營收報表 分割檔3<BR>2016台股上市櫃9月營收報表 分割檔4<BR>2016台股上市櫃9月營收報表 分割檔5<BR>2016台股上市櫃9月營收報表 分割檔6<BR><BR>六個分割檔都要下載, 下載完畢後解壓縮即可。",2
6504,1476419315808_F01,台股拉回就是買點~,買哪隻?<BR>2330 <BR>台股衝衝衝，無基本面，所向無敵<BR>已經把T50賣光重壓2330!,2
6506,1476422137222_F01,台股現在的線型，真的很危險..,似乎已經漲不太上去了，<BR>目前有每漲一天就跌兩天的感覺...<BR>實在不敢在這時候加碼..<BR>況且台股目前還沒大崩，<BR>我就已經套牢這麼多支了<BR>如果台股現在來個垂直大崩跌，<BR>我的帳面肯定會很慘，<BR>最近確實有點緊張..<BR>台股接下來一口氣往下走的機率極高呀,2
6513,1476458483490_F01,也許大盤到年底前還會有高點 10/14寫,此處壓力重重<BR>看歷史的高點，這裏是重壓，高檔震盪<BR>從陸股和美股的觀查，也許到年底還有高點<BR>美總統大選完，就不太妙了<BR>目前的小小觀查<BR>台股跌深的會反彈，也許力道很強，會讓台股不至於跌很深~~~~次級要素<BR>陸股長假過後需做統計<BR>還有過年前也需做統計<BR>北韓情勢動當不安，需觀查有小動作嗎,2
6554,1476722940982_1_F01,台股如死水 9月周轉率創歷史新低,據金管會最新統計，9月台股的月周轉率只剩4.8%，首度跌破5%，創下歷年來單月最低紀錄。<BR>炒股?炒房?再炒阿! 這次就是要看戲,2
6594,1476850868937_F01,台股再度起死回生,阿娘喂~<BR>前幾天擺明就是先蹲後跳的概念，<BR>還好股票都抱緊緊，<BR>這波台股要玩真的了，<BR>離11/8不遠矣.<BR>年底就看這波了，<BR>有跟到的應該都能獲利，<BR>重點是大家一定要跟對方向,2
6596,1476853445176_F01,轉錄-謝金河：早預告台股無量 到樓塌才會醒,"老謝頓台灣金融市場的未來看法,感覺上他對台灣未來感到悲觀....<BR>對來台灣金融市場未來會如何,值得觀察....<BR><BR>轉錄網路新聞:謝金河：早預告台股無量 到樓塌才會醒<BR>http://www.cna.com.tw/news/afe/201610190110-1.aspx<BR>財信傳媒董事長謝金河指出，3年前早就預告股市無量的隱憂，只是掌握權力的人不在乎，最近終於引發外界關注，這種溫水煮青蛙的現象，要到樓塌了，大家才會醒過來。<BR>謝金河在臉書再次強調，租稅是經濟活動最重要的遊戲規則，台灣的租稅不公平，從證所稅課內資，不課外資開始，到健全財政方案，再把內外資的不公平極大化。<BR>因此，外資輕稅，本國人重稅，於是大咖的有錢人都變成外資。政府鼓勵有錢人變外國人，於是股市一面倒只剩下外資活躍，內資式微景象。<BR>他說，如果簡化台股今天的情況，指數在9200點，大家要很開心，但這是外資買超台積電80%撐起來的，本國投資人卻在像樂陞這樣的陷阱中慘遭殺戮，一次殺2萬人。<BR>他認為，政府厚待外資，放任本國投資人被宰殺，國民黨如此，民進黨也是如此。1997年台股週轉率790%，今年恐怕不到60%，股市逼近萬點，卻有大批營業員流離失業，券商營業據點每天都有人在縮點，政府卻一點也不在乎。<BR>他表示，政府除了打昏股市，也打昏房市，過去房屋課稅太輕，造成炒房，房價高漲，成了民怨之首，現在弄出的房屋稅制又嫌太重，房市幾乎沒有交易。<BR>他批評，打死股市，房市，等於打斷經濟內需的兩條腿，台灣經濟再也站不起來，產業得不到養分，台灣的處境會愈來愈辛苦，年輕人會愈找不到出路，整個社會繼續往下沉淪.........",2
6597,1476858963235_F01,請教現股避險問題,台股股市9300點時，若持有現股約100萬，請教各位應該要多少金額來做避險，比較合適?<BR>期貨若不會做，應該買T50反1，多少張來避險?,2
6619,1477014728141_F01,台股這漲勢和氣勢真的非常驚人阿!,"小弟這陣子在01看到很多大大對台股指數不是太樂觀<BR>從9000看到現在的9300<BR>只能印證一句話,大家越悲觀但往往都指數都往樂觀走<BR>這波我也沒跟到,即使會到9500我也不敢跟<BR>感覺上現在多空都不好做,只好等看未來的趨勢和變化了<BR>不知道各位大大對指數有什麼看法阿!",2
6620,1477014734887_F01,不知台股是否有推石油反的商品??,現台股有推 00642U元大S&P石油<BR>但不知台股是否有推石油反的商品??<BR>誠心請教謝謝~,2
6665,1477283366036_F01,台積電,台積電今天190.5融券空3張，感覺上面賣壓很重，應該漲不太上去，大盤也有力無力的，應該也差不多了。,2
6666,1477284219599_F01,目前大盤這週看空,目前大盤這週看空<BR>先空了台積電191五張<BR>準備穩健獲利<BR>下週低點再補回,2
6684,1477321060969_F01,台股將史無前例一飛沖天，跌破散戶眼鏡(小菲特你的眼鏡快顧好!),<BR>11/8將近，<BR>台股從去年8月洗盤至今，<BR>動搖了多少散戶的心?<BR>大家心裡有數<BR>難道這波將會是最後高潮波?<BR>股海中最極致的奧秘「拉高出貨」<BR>如果你還緊抱著股票到今天，<BR>接下來真得要特別注意了，<BR>依古法「透析術」得知，<BR>近期將有九成機率頸噴至前高，<BR>僅有一成機率往下走，<BR>我們不能輕忽古法得知的資訊，<BR>但也尊重小菲特的獨特看法,2
6694,1477365297832_F01,提升證交所電腦產能利用率 - 取消證交稅,"依據資深股民的說法, 20 年前台股每日成交量約有 2000 億, 相對今日的 500 億, 縮減為 1/4.<BR>如果證交所的電腦 20 年前 CPU 的使用率為 80%, 那今日 CPU 則為 20%.<BR>如果證交所可以在交易電腦上開發新的線上遊戲, 充份利用 CPU 的閒置時間, 讓股民可以在成交低迷的台股交易時段可以在看盤畫面的另一半打電動, 不但可以讓股民不會感覺無聊, 而且可依時間收費, 增加國庫營收.<BR>或許這樣做就可以將證交稅取消.<BR>雙贏.",2
6696,1477371444611_F01,股市投資的真諦...,今天台股目前高點9399.應該還有機會挑戰9400<BR>很多人好奇台灣經濟不是不好嗎.怎麼還會創15個月新高.<BR>我2004年2月進這個市場.<BR>一個月就賺了不少因為要總統大選<BR>那年的319過後也讓我賠了不少因為總統槍擊案<BR>中間也經過了2008年的金融海嘯<BR>2012年的希臘危機<BR>那麼今年的台灣為何台股那麼強<BR>答案是投資報酬率的問題<BR>2004年當年定存利率約3趴左右<BR>2008年未降息前也約2趴上下<BR>2012年也有約1.5趴<BR>以一年期的定存利率為基礎<BR>以台積電為例<BR>2007年台積電一年股利約3.5元當年股價55-60元<BR>那年定存約利率2趴<BR>買台積電60元股利3.5元約5.8趴利息<BR>獲利約定存的3倍多<BR>今年定存約1.1趴<BR>台積電配息前高點160元.配息6元約3.8趴利息<BR>也是定存的3倍多<BR>明年台積電預計成長 在台灣不升息的狀態<BR>當然投資加值就會越高<BR>只要台灣央行不升息的一點<BR>投資股票獲利只要是定存利息的3倍價值以上<BR>就是會有人願意一直扛上去<BR>但是只要一升息整個盤面就會修正<BR>這也是為何美股上個月9月升不升息<BR>股價不穩的問題<BR>目前可能推估12月升息 11月大選<BR>未來一個月緩漲的機率是存在的<BR>美國升息後 今年12月台灣央行升息機率可能不高<BR>但明年第一季3月 就看美國有沒有連續升息<BR>台灣可能就會更進微幅升息<BR>,2
6710,1477405682311_F01,"想投資美股,美股中也有適合長期投資的定存股嗎?","最近開始想投資美股,上Scottrade證?網站申請了一個美股交易帳戶,想來試試美股投資.<BR>過去在台股中投資以定存股為主,長期投資電信/保全/傳產民生龍頭等,<BR>至於投資美股,對自己來說一切是新的開始,經驗從零開始累積.<BR>不知道美股中有沒有適合長期投資的定存股? <BR>歡迎有長期投資美股的大大分享投資心得! <BR>",2
6729,1477535521411_F01,台股黑棒降臨,說好的一飛沖天呢?<BR>結果真的是拉高出貨<BR>離11/8已經不遠矣，<BR>難道台股要提前開大絕了嗎...<BR>看來防禦措施不可少，<BR>我要先出清有獲利的持股了，<BR>避免受重傷,2
6759,1477625322163_F01,台股如死水… 阿土伯：我已變宅男,台股如死水… 阿土伯：我已變宅男<BR>金管會主委李瑞倉上任首日，拋出將研究調降證交稅率，但資深投資人阿土伯則對李瑞倉說法投以不信任票，「有做（確定修法調降）再說！」面對台股有如一攤死水，「我早已變成宅男了！」<BR>= = = = = = = = = = = = = = = <BR>看到台股的交易量，覺得阿土伯的話真是貼切。,2
